Date,Season,Time,TeamHome,ResultTeamHome,ResultTeamAway,TeamAway,ManagerHome,ManagerAway,FormationHome,FormationAway,RatingTeamHome,RatingTeamAway,Stadium,Weather,Referee,StartTeamHome,RatingStartTeamHome,SubstitutionHome,RatingSubstitutionHome,StartTeamAway,RatingStartTeamAway,SubstitutionAway,RatingSubstitutionAway,TotalShotsHome,TotalShotsAway,PossessionHome,PossessionAway,PassAccuracyHome,PassAccuracyAway,DribblesHome,DribblesAway,AerialsWonHome,AerialsWonAway,TacklesHome,TacklesAway,CornersHome,CornersAway,DispossessedHome,DispossessedAway,GoalsHome,GoalsAway,AssistsHome,AssistsAway,YellowCardHome,YellowCardAway,RedCardHome,RedCardAway
21-Dec-19,2019/2020,15:00,Norwich,1,2,Wolves,Daniel Farke,Nuno Espírito Santo,4-2-3-1,3-4-3,6.66,6.83,Carrow Road,,Peter Bankes,"Tim Krul, Max Aarons, Christoph Zimmermann, Grant Hanley, Sam Byram, Tom Trybull, Alexander Tettey, Emiliano Buendía, Kenny McLean, Todd Cantwell, Teemu Pukki, Rui Patrício","6.0, 6.6, 6.0, 6.4, 6.6, 6.7, 6.4, 9.3, 6.8, 7.5, 6.7, 7.9","Onel Hernández, Dennis Srbeny, Mario Vrancic, Ibrahim Amadou, Marco Stiepermann, Ralf Fährmann, Jamal Lewis","6.2, 6.1, 6.0, 6.0, 6.0, 6.0, 6.0","Leander Dendoncker, Romain Saïss, Conor Coady, Matt Doherty, Jonny, Rúben Neves, João Moutinho, Adama Traoré, Raúl Jiménez, Diogo Jota","6.4, 7.7, 6.0, 6.8, 5.8, 6.8, 6.7, 8.2, 7.7, 6.1","Pedro Neto, Patrick Cutrone, Rúben Vinagre, Jesús Vallejo, Maximilian Kilman, Ryan Bennett, John Ruddy","6.6, 6.2, 6.0, 6.0, 6.0, 6.0, 6.0",13,14,50.2,49.8,80,81,18,12,20,20,15,13,3,11,7,5,Todd Cantwell,"Romain Saïss, Raúl Jiménez",,João Moutinho,2,4,0,0
21-Dec-19,2019/2020,15:00,Aston Villa,1,3,Southampton,Dean Smith,Ralph Hasenhüttl,4-3-3,4-4-2,6.61,6.90,Villa Park,Clear,Craig Pawson,"Tom Heaton, Frederic Guilbert, Björn Engels, Kortney Hause, Matt Targett, Douglas Luiz, Conor Hourihane, John McGinn, Anwar El Ghazi, Wesley, Jack Grealish, Alex McCarthy","6.8, 7.5, 6.5, 7.0, 6.2, 6.3, 5.9, 6.1, 6.1, 6.6, 8.7, 7.1","Jonathan Kodjia, Marvelous Nakamba, Trézéguet, Ahmed El Mohamady, Ørjan Nyland, Ezri Konsa Ngoyo, Henri Lansbury","6.2, 6.1, 6.5, 6.0, 6.0, 6.0, 6.0","Cédric Soares, Jan Bednarek, Jack Stephens, Ryan Bertrand, Stuart Armstrong, Pierre-Emile Højbjerg, James Ward-Prowse, Nathan Redmond, Shane Long, Danny Ings","6.4, 6.8, 8.1, 6.5, 6.5, 7.1, 7.5, 6.8, 7.1, 8.8","Che Adams, Oriol Romeu, Michael Obafemi, Jannik Vestergaard, Maya Yoshida, Sofiane Boufal, Angus Gunn","6.0, 6.1, 6.0, 6.0, 6.0, 6.0, 6.0",19,17,56.5,43.5,78,69,13,6,35,17,9,16,7,5,9,9,Jack Grealish,"Danny Ings, Jack Stephens, Danny Ings",,James Ward-Prowse,2,1,0,0
21-Dec-19,2019/2020,15:00,Bournemouth,0,1,Burnley,Eddie Howe,Sean Dyche,4-5-1,4-4-2,6.42,6.61,Vitality Stadium,Clear,Martin Atkinson,"Aaron Ramsdale, Jack Stacey, Simon Francis, Chris Mepham, Diego Rico, Lewis Cook, Jefferson Lerma, Philip Billing, Dan Gosling, Ryan Fraser, Joshua King, Nick Pope","6.3, 6.4, 6.8, 7.1, 6.0, 6.2, 6.5, 7.1, 6.4, 6.2, 6.7, 6.6","Dominic Solanke, Callum Wilson, Gavin Kilkenny, Artur Boruc, Andrew Surman, Jack Simpson, Junior Stanislas","5.9, 6.0, 6.0, 6.0, 6.0, 6.0, 6.0","Phil Bardsley, Ben Mee, James Tarkowski, Charlie Taylor, Jeff Hendrick, Ashley Westwood, Jack Cork, Dwight McNeil, Chris Wood, Ashley Barnes","6.6, 7.0, 7.6, 7.4, 6.0, 6.8, 6.6, 6.0, 5.9, 6.6","Aaron Lennon, Jay Rodriguez, Robbie Brady, Kevin Long, Erik Pieters, Daniel Drinkwater, Joe Hart","6.3, 7.2, 6.1, 6.0, 6.0, 6.0, 6.0",3,2,64.8,35.2,77,58,5,0,24,24,15,13,4,5,7,8,,Jay Rodriguez,,Ashley Westwood,2,4,0,0
21-Dec-19,2019/2020,15:00,Brighton,0,1,Sheff Utd,Graham Potter,Chris Wilder,4-2-3-1,3-5-2,6.25,6.88,Amex Stadium,Clear,Robert Jones,"Mat Ryan, Martín Montoya, Adam Webster, Lewis Dunk, Dan Burn, Davy Pröpper, Dale Stephens, Aaron Mooy, Pascal Groß, Leandro Trossard, Neal Maupay, Dean Henderson","6.0, 6.1, 5.8, 7.1, 6.9, 6.2, 6.4, 6.9, 5.9, 5.8, 6.0, 6.7","Aaron Connolly, Glenn Murray, Yves Bissouma, Bernardo, Steven Alzate, Shane Duffy, David Button","6.0, 6.0, 6.5, 6.0, 6.0, 6.0, 6.0","John Egan, Chris Basham, Jack O'Connell, George Baldock, Enda Stevens, Luke Freeman, John Lundstram, Oliver Norwood, David McGoldrick, Oliver McBurnie","7.5, 7.6, 7.3, 6.7, 6.9, 6.5, 7.1, 6.8, 6.8, 7.6","Ben Osborn, Lys Mousset, Muhamed Besic, Callum Robinson, Michael Verrips, Phil Jagielka, Billy Sharp","6.2, 6.6, 6.0, 6.0, 6.0, 6.0, 6.0",9,7,69,31,82,64,10,9,28,29,9,22,4,3,11,4,,Oliver McBurnie,,,1,3,0,0
21-Dec-19,2019/2020,17:30,Man City,3,1,Leicester,Josep Guardiola,Brendan Rodgers,4-2-3-1,4-1-4-1,7.07,6.33,Etihad Stadium,,Mike Dean,"Ederson, Kyle Walker, Nicolás Otamendi, Fernandinho, Benjamin Mendy, Ilkay Gündogan, Bernardo Silva, Riyad Mahrez, Kevin De Bruyne, Raheem Sterling, Gabriel Jesus, Kasper Schmeichel","6.3, 6.7, 6.8, 6.7, 7.9, 7.2, 6.7, 9.1, 9.1, 7.1, 7.6, 7.3","Phil Foden, Rodrigo, Sergio Agüero, Claudio Bravo, João Cancelo, Eric García, Oleksandr Zinchenko","6.0, 6.1, 5.9, 6.0, 6.0, 6.0, 6.0","Ricardo Pereira, Çaglar Söyüncü, Jonny Evans, Ben Chilwell, Wilfred Ndidi, Ayoze Pérez, Youri Tielemans, James Maddison, Harvey Barnes, Jamie Vardy","5.5, 6.2, 6.6, 5.9, 6.3, 6.2, 5.9, 6.3, 6.7, 7.8","Marc Albrighton, Demarai Gray, Dennis Praet, Wes Morgan, Kelechi Iheanacho, James Justin, Danny Ward","6.1, 5.8, 6.0, 6.0, 6.0, 6.0, 6.0",23,5,62.7,37.3,90,81,10,8,8,11,19,14,6,0,7,9,"Riyad Mahrez, Ilkay Gündogan, Gabriel Jesus",Jamie Vardy,"Benjamin Mendy, Kevin De Bruyne",Harvey Barnes,2,2,0,0
22-Dec-19,2019/2020,14:00,Watford,2,0,Man Utd,Nigel Pearson,Ole Gunnar Solskjær,4-2-3-1,4-2-3-1,7.10,6.53,Vicarage Road,,Lee Mason,"Ben Foster, Adrian Mariappa, Christian Kabasele, Craig Cathcart, Kiko Femenía, Etienne Capoue, Will Hughes, Ismaila Sarr, Abdoulaye Doucouré, Gerard Deulofeu, Troy Deeney, David de Gea","7.9, 7.2, 7.4, 6.9, 7.2, 7.2, 7.3, 7.8, 6.5, 8.3, 7.5, 5.1","Nathaniel Chalobah, Isaac Success, Roberto Pereyra, Heurelho Gomes, Adam Masina, Andre Gray, Craig Dawson","6.1, 6.1, 6.2, 6.0, 6.0, 6.0, 6.0","Aaron Wan-Bissaka, Victor Lindelöf, Harry Maguire, Luke Shaw, Fred, Scott McTominay, Daniel James, Jesse Lingard, Marcus Rashford, Anthony Martial","6.4, 6.3, 7.5, 6.9, 7.2, 6.6, 6.1, 6.2, 6.5, 7.5","Mason Greenwood, Juan Mata, Paul Pogba, Sergio Romero, Andreas Pereira, Nemanja Matic, Ashley Young","6.2, 6.4, 6.6, 6.0, 6.0, 6.0, 6.0",11,17,36.1,63.9,67,84,13,17,11,25,19,18,3,5,8,8,"Ismaila Sarr, Troy Deeney",,Christian Kabasele,,3,1,0,0
22-Dec-19,2019/2020,16:30,Tottenham,0,2,Chelsea,José Mourinho,Frank Lampard,4-3-3,3-4-2-1,6.23,7.05,Tottenham Hotspur Stadium,Clear,Anthony Taylor,"Paulo Gazzaniga, Serge Aurier, Toby Alderweireld, Davinson Sánchez, Jan Vertonghen, Moussa Sissoko, Eric Dier, Dele Alli, Lucas Moura, Harry Kane, Son Heung-Min, Kepa Arrizabalaga","5.3, 7.2, 6.7, 7.1, 6.4, 6.8, 5.8, 6.0, 6.0, 6.3, 4.7, 6.8","Danny Rose, Tanguy Ndombele, Christian Eriksen, Giovani Lo Celso, Juan Foyth, Michel Vorm, Harry Winks","6.2, 6.4, 6.3, 6.0, 6.0, 6.0, 6.0","Kurt Zouma, Antonio Rüdiger, Fikayo Tomori, César Azpilicueta, Marcos Alonso, Mateo Kovacic, N'Golo Kanté, Willian, Mason Mount, Tammy Abraham","6.8, 6.6, 7.0, 6.9, 7.8, 7.4, 7.5, 9.2, 7.0, 7.0","Reece James, Jorginho, Michy Batshuayi, Willy Caballero, Andreas Christensen, Christian Pulisic, Callum Hudson-Odoi","6.0, 6.5, 6.2, 6.0, 6.0, 6.0, 6.0",5,13,44.5,55.5,78,82,12,14,17,17,19,16,3,5,13,10,,"Willian, Willian",,Mateo Kovacic,4,3,1,0
26-Dec-19,2019/2020,12:30,Tottenham,2,1,Brighton,José Mourinho,Graham Potter,3-4-2-1,3-4-2-1,6.76,6.79,Tottenham Hotspur Stadium,Clear,Graham Scott,"Paulo Gazzaniga, Toby Alderweireld, Jan Vertonghen, Davinson Sánchez, Serge Aurier, Ryan Sessegnon, Moussa Sissoko, Harry Winks, Lucas Moura, Dele Alli, Harry Kane, Mat Ryan","6.8, 6.5, 7.2, 6.2, 7.6, 6.0, 6.7, 6.6, 6.5, 7.4, 8.2, 6.5","Eric Dier, Christian Eriksen, Giovani Lo Celso, Erik Lamela, Juan Foyth, Michel Vorm, Japhet Tanganga","6.3, 6.2, 6.3, 6.0, 6.0, 6.0, 6.0","Shane Duffy, Adam Webster, Dan Burn, Ezequiel Schelotto, Bernardo, Steven Alzate, Dale Stephens, Aaron Mooy, Pascal Groß, Aaron Connolly","6.9, 8.2, 6.7, 6.7, 7.8, 7.1, 6.8, 6.9, 7.2, 6.0","Yves Bissouma, Neal Maupay, Leandro Trossard, Davy Pröpper, Martín Montoya, Glenn Murray, David Button","6.4, 5.9, 6.0, 6.0, 6.0, 6.0, 6.0",11,11,53.8,46.2,79,80,11,17,9,22,19,23,9,2,11,13,"Harry Kane, Dele Alli",Adam Webster,Serge Aurier,Pascal Groß,4,2,0,0
26-Dec-19,2019/2020,15:00,Sheff Utd,1,1,Watford,Chris Wilder,Nigel Pearson,3-5-2,4-2-3-1,6.84,6.48,Bramall Lane,Clear,David Coote,"Dean Henderson, John Egan, Jack O'Connell, Chris Basham, George Baldock, Enda Stevens, John Lundstram, John Fleck, Oliver Norwood, David McGoldrick, Oliver McBurnie, Ben Foster","6.1, 7.7, 7.3, 7.1, 6.6, 6.9, 6.3, 6.3, 7.9, 6.8, 6.8, 7.1","Lys Mousset, Muhamed Besic, Callum Robinson, Michael Verrips, Luke Freeman, Phil Jagielka, Billy Sharp","6.3, 6.0, 6.0, 6.0, 6.0, 6.0, 6.0","Adrian Mariappa, Christian Kabasele, Craig Cathcart, Kiko Femenía, Etienne Capoue, Will Hughes, Ismaila Sarr, Nathaniel Chalobah, Gerard Deulofeu, Troy Deeney","6.3, 7.2, 5.9, 6.7, 6.6, 6.0, 6.1, 6.8, 6.7, 6.9","Andre Gray, Craig Dawson, Roberto Pereyra, Heurelho Gomes, Isaac Success, Domingos Quina, Tom Dele-Bashiru","6.1, 6.3, 6.2, 6.0, 6.0, 6.0, 6.0",16,5,58.1,41.9,76,69,12,6,35,26,18,7,9,1,6,8,Oliver Norwood,Gerard Deulofeu,,Nathaniel Chalobah,0,3,0,0
26-Dec-19,2019/2020,15:00,Aston Villa,1,0,Norwich,Dean Smith,Daniel Farke,4-2-3-1,4-2-3-1,7.03,6.51,Villa Park,Clear,Chris Kavanagh,"Tom Heaton, Ahmed El Mohamady, Ezri Konsa Ngoyo, Kortney Hause, Matt Targett, Douglas Luiz, Marvelous Nakamba, Anwar El Ghazi, Jack Grealish, Trézéguet, Wesley, Tim Krul","7.7, 6.7, 6.9, 8.1, 7.0, 7.3, 6.7, 7.1, 8.4, 6.8, 6.7, 6.0","Henri Lansbury, Jota, Conor Hourihane, Björn Engels, Frederic Guilbert, Ørjan Nyland, Jonathan Kodjia","6.1, 6.0, 7.4, 6.0, 6.0, 6.0, 6.0","Max Aarons, Christoph Zimmermann, Grant Hanley, Sam Byram, Tom Trybull, Alexander Tettey, Emiliano Buendía, Kenny McLean, Todd Cantwell, Teemu Pukki","7.5, 6.6, 6.6, 6.8, 6.6, 6.7, 7.4, 6.8, 6.1, 5.7","Onel Hernández, Marco Stiepermann, Mario Vrancic, Ibrahim Amadou, Dennis Srbeny, Ralf Fährmann, Jamal Lewis","6.2, 6.0, 6.1, 6.0, 6.0, 6.0, 6.0",11,16,42.5,57.5,75,83,9,11,25,16,19,7,5,8,6,10,Conor Hourihane,,Jack Grealish,,2,4,0,0
26-Dec-19,2019/2020,15:00,Bournemouth,1,1,Arsenal,Eddie Howe,Mikel Arteta,4-5-1,4-2-3-1,6.65,6.60,Vitality Stadium,Clear,Stuart Attwell,"Aaron Ramsdale, Jack Stacey, Steve Cook, Chris Mepham, Jack Simpson, Ryan Fraser, Jefferson Lerma, Dan Gosling, Lewis Cook, Joshua King, Callum Wilson, Bernd Leno","6.3, 7.4, 6.6, 7.0, 6.8, 6.1, 7.0, 7.3, 6.5, 6.2, 6.4, 7.3","Harry Wilson, Philip Billing, Gavin Kilkenny, Artur Boruc, Andrew Surman, Junior Stanislas, Dominic Solanke","6.5, 6.4, 6.0, 6.0, 6.0, 6.0, 6.0","Ainsley Maitland-Niles, David Luiz, Sokratis, Bukayo Saka, Granit Xhaka, Lucas Torreira, Reiss Nelson, Mesut Özil, Pierre-Emerick Aubameyang, Alexandre Lacazette","6.3, 6.8, 6.5, 6.5, 7.1, 6.9, 6.5, 6.5, 7.0, 6.2","Nicolas Pépé, Joseph Willock, Shkodran Mustafi, Emiliano Martínez, Matteo Guendouzi, Konstantinos Mavropanos, Emile Smith Rowe","6.4, 6.2, 6.2, 6.0, 6.0, 6.0, 6.0",12,17,39.5,60.5,80,87,9,8,14,12,16,10,8,3,8,8,Dan Gosling,Pierre-Emerick Aubameyang,Jack Stacey,,4,4,0,0
26-Dec-19,2019/2020,15:00,Chelsea,0,2,Southampton,Frank Lampard,Ralph Hasenhüttl,3-4-2-1,4-4-2,6.43,7.12,Stamford Bridge,Clear,Jonathan Moss,"Kepa Arrizabalaga, Kurt Zouma, Antonio Rüdiger, Fikayo Tomori, César Azpilicueta, Emerson, N'Golo Kanté, Jorginho, Willian, Callum Hudson-Odoi, Tammy Abraham, Alex McCarthy","6.0, 7.0, 6.4, 7.0, 7.0, 6.3, 5.9, 6.8, 6.5, 6.2, 6.1, 7.6","Mason Mount, Christian Pulisic, Pedro, Willy Caballero, Michy Batshuayi, Andreas Christensen, Ross Barkley","6.7, 6.1, 6.2, 6.0, 6.0, 6.0, 6.0","Cédric Soares, Jan Bednarek, Jack Stephens, Ryan Bertrand, Stuart Armstrong, Pierre-Emile Højbjerg, James Ward-Prowse, Nathan Redmond, Michael Obafemi, Che Adams","7.7, 7.5, 7.5, 6.8, 7.4, 7.5, 7.5, 7.2, 7.4, 7.0","Danny Ings, Oriol Romeu, Sofiane Boufal, Kevin Danso, Jannik Vestergaard, Maya Yoshida, Angus Gunn","6.2, 6.2, 6.1, 6.0, 6.0, 6.0, 6.0",10,5,66.1,33.9,81,63,16,11,34,27,21,32,8,1,19,13,,"Michael Obafemi, Nathan Redmond",,Pierre-Emile Højbjerg,3,2,0,0
26-Dec-19,2019/2020,15:00,Crystal Palace,2,1,West Ham,Roy Hodgson,Manuel Pellegrini,4-5-1,4-4-2,6.92,6.82,Selhurst Park,Clear,Andre Marriner,"Vicente Guaita, Martin Kelly, Mamadou Sakho, James Tomkins, Patrick van Aanholt, Max Meyer, Cheikhou Kouyaté, Luka Milivojevic, James McArthur, Wilfried Zaha, Jordan Ayew, Roberto Jiménez","6.2, 6.5, 7.0, 6.8, 7.0, 6.6, 7.5, 6.5, 6.1, 8.2, 9.6, 6.8","Connor Wickham, Jairo Riedewald, James McCarthy, Víctor Camarasa, Sam Woods, Wayne Hennessey, Brandon Pierrick Keutcha","6.4, 6.3, 6.1, 6.0, 6.0, 6.0, 6.0","Pablo Zabaleta, Angelo Ogbonna, Fabián Balbuena, Aaron Cresswell, Robert Snodgrass, Declan Rice, Mark Noble, Pablo Fornals, Sébastien Haller, Michail Antonio","7.1, 6.2, 6.6, 6.5, 7.2, 7.3, 7.3, 6.7, 6.5, 8.1","Albian Ajeti, Felipe Anderson, Manuel Lanzini, Carlos Sánchez, Arthur Masuaku, Issa Diop, Joseph Anang","6.0, 6.7, 6.4, 6.0, 6.0, 6.0, 6.0",13,10,58.2,41.8,83,74,24,16,16,27,16,30,7,6,14,5,"Cheikhou Kouyaté, Jordan Ayew",Robert Snodgrass,"Jordan Ayew, Connor Wickham",Michail Antonio,0,2,0,0
26-Dec-19,2019/2020,15:00,Everton,1,0,Burnley,Carlo Ancelotti,Sean Dyche,3-4-1-2,4-4-2,6.94,6.56,Goodison Park,Clear,Anthony Taylor,"Jordan Pickford, Yerry Mina, Séamus Coleman, Mason Holgate, Djibril Sidibé, Gylfi Sigurdsson, Fabian Delph, Lucas Digne, Bernard, Richarlison, Dominic Calvert-Lewin, Nick Pope","6.4, 7.4, 7.1, 7.2, 8.1, 7.5, 6.8, 6.9, 7.1, 7.2, 7.4, 7.1","Tom Davies, Theo Walcott, Moise Kean, Maarten Stekelenburg, Cenk Tosun, Leighton Baines, Michael Keane","6.1, 6.0, 6.1, 6.0, 6.0, 6.0, 6.0","Phil Bardsley, Ben Mee, James Tarkowski, Charlie Taylor, Robbie Brady, Ashley Westwood, Jack Cork, Dwight McNeil, Chris Wood, Jay Rodriguez","6.6, 7.4, 7.0, 7.8, 7.0, 6.4, 5.9, 6.6, 6.0, 6.0","Ashley Barnes, Kevin Long, Jóhann Gudmundsson, Erik Pieters, Joe Hart, Daniel Drinkwater, Matthew Lowton","6.0, 6.1, 5.8, 6.0, 6.0, 6.0, 6.0",21,6,67.5,32.5,82,56,12,2,32,36,5,20,10,2,10,2,Dominic Calvert-Lewin,,Djibril Sidibé,,0,0,0,0
26-Dec-19,2019/2020,17:30,Man Utd,4,1,Newcastle,Ole Gunnar Solskjær,Steve Bruce,4-2-3-1,3-5-2,7.20,6.14,Old Trafford,Clear,Kevin Friend,"David de Gea, Aaron Wan-Bissaka, Victor Lindelöf, Harry Maguire, Luke Shaw, Fred, Scott McTominay, Mason Greenwood, Andreas Pereira, Marcus Rashford, Anthony Martial, Martin Dubravka","6.2, 7.8, 6.5, 7.8, 7.0, 7.0, 6.6, 8.1, 7.2, 7.3, 9.1, 5.5","Jesse Lingard, Juan Mata, Paul Pogba, Sergio Romero, Ashley Young, Phil Jones, Daniel James","6.4, 6.5, 7.3, 6.0, 6.0, 6.0, 6.0","Federico Fernández, Florian Lejeune, Fabian Schär, Javier Manquillo, Jetro Willems, Miguel Almirón, Sean Longstaff, Matthew Longstaff, Joelinton, Dwight Gayle","5.9, 6.0, 5.3, 6.3, 6.0, 6.5, 5.8, 6.8, 7.7, 5.9","DeAndre Yedlin, Emil Krafth, Christian Atsu, Isaac Hayden, Karl Darlow, Andy Carroll, Jonjo Shelvey","5.9, 6.3, 6.2, 6.0, 6.0, 6.0, 6.0",22,7,73.3,26.7,90,72,13,10,14,17,17,20,5,0,11,10,"Anthony Martial, Mason Greenwood, Marcus Rashford, Anthony Martial",Matthew Longstaff,"Andreas Pereira, Aaron Wan-Bissaka",Joelinton,2,2,0,0
26-Dec-19,2019/2020,20:00,Leicester,0,4,Liverpool,Brendan Rodgers,Jürgen Klopp,4-1-4-1,4-3-3,5.92,7.38,King Power Stadium,Clear,Michael Oliver,"Kasper Schmeichel, Ricardo Pereira, Çaglar Söyüncü, Jonny Evans, Ben Chilwell, Wilfred Ndidi, Harvey Barnes, Dennis Praet, Youri Tielemans, James Maddison, Jamie Vardy, Alisson","5.5, 6.9, 6.1, 5.3, 6.0, 6.8, 5.8, 5.7, 5.8, 5.5, 6.0, 6.6","Hamza Choudhury, Marc Albrighton, Ayoze Pérez, Wes Morgan, Demarai Gray, James Justin, Danny Ward","6.1, 5.8, 5.8, 6.0, 6.0, 6.0, 6.0","Trent Alexander-Arnold, Virgil van Dijk, Joseph Gomez, Andrew Robertson, Naby Keita, Georginio Wijnaldum, Jordan Henderson, Mohamed Salah, Roberto Firmino, Sadio Mané","9.7, 6.8, 7.0, 8.0, 8.0, 7.6, 7.4, 6.7, 8.8, 7.2","Adam Lallana, James Milner, Divock Origi, Adrián, Xherdan Shaqiri, Neco Williams, Curtis Jones","6.0, 7.0, 6.6, 6.0, 6.0, 6.0, 6.0",3,15,41.2,58.8,82,86,11,18,12,13,16,10,2,8,2,11,,"Roberto Firmino, James Milner, Roberto Firmino, Trent Alexander-Arnold",,"Trent Alexander-Arnold, Trent Alexander-Arnold, Sadio Mané",1,1,0,0
27-Dec-19,2019/2020,19:45,Wolves,3,2,Man City,Nuno Espírito Santo,Josep Guardiola,3-4-3,4-2-3-1,7.08,6.47,Molineux Stadium,Clear,Martin Atkinson,"Rui Patrício, Leander Dendoncker, Romain Saïss, Conor Coady, Matt Doherty, Jonny, Rúben Neves, João Moutinho, Adama Traoré, Raúl Jiménez, Diogo Jota, Ederson","6.8, 6.6, 6.4, 6.6, 7.8, 6.6, 7.5, 7.3, 10, 8.4, 6.6, 5.1","Ryan Bennett, Rúben Vinagre, Pedro Neto, Patrick Cutrone, Jesús Vallejo, John Ruddy, Maximilian Kilman","6.0, 6.3, 6.3, 6.0, 6.0, 6.0, 6.0","Kyle Walker, Nicolás Otamendi, Fernandinho, Benjamin Mendy, Bernardo Silva, Rodrigo, Riyad Mahrez, Kevin De Bruyne, Raheem Sterling, Sergio Agüero","6.3, 6.7, 6.4, 5.8, 6.3, 6.1, 7.4, 7.9, 7.6, 6.1","Eric García, Ilkay Gündogan, Claudio Bravo, João Cancelo, Angeliño, Oleksandr Zinchenko, Phil Foden","6.3, 5.8, 6.8, 6.0, 6.0, 6.0, 6.0",21,7,61.9,38.1,89,79,18,9,21,18,13,16,3,1,8,5,"Adama Traoré, Raúl Jiménez, Matt Doherty","Raheem Sterling, Raheem Sterling","Rúben Neves, Adama Traoré, Raúl Jiménez",Kevin De Bruyne,0,1,0,1
28-Dec-19,2019/2020,12:30,Brighton,2,0,Bournemouth,Graham Potter,Eddie Howe,4-2-3-1,4-4-2,7.30,6.40,Amex Stadium,Clear,Paul Tierney,"Mat Ryan, Martín Montoya, Shane Duffy, Lewis Dunk, Dan Burn, Yves Bissouma, Davy Pröpper, Alireza Jahanbakhsh, Aaron Mooy, Leandro Trossard, Neal Maupay, Aaron Ramsdale","7.1, 7.4, 7.1, 7.2, 7.5, 8.1, 7.2, 8.0, 8.5, 7.6, 7.5, 6.8","Dale Stephens, Glenn Murray, Steven Alzate, Bernardo, Pascal Groß, Adam Webster, David Button","6.5, 6.2, 6.3, 6.0, 6.0, 6.0, 6.0","Jack Stacey, Steve Cook, Chris Mepham, Diego Rico, Harry Wilson, Philip Billing, Dan Gosling, Junior Stanislas, Joshua King, Dominic Solanke","6.4, 6.7, 7.0, 6.5, 6.1, 6.5, 6.3, 6.7, 6.2, 6.3","Ryan Fraser, Lewis Cook, Callum Wilson, Jefferson Lerma, Artur Boruc, Andrew Surman, Jack Simpson","6.0, 6.1, 6.0, 6.0, 6.0, 6.0, 6.0",16,10,55.1,44.9,83,77,11,6,24,22,23,18,9,2,12,16,"Alireza Jahanbakhsh, Aaron Mooy",,"Neal Maupay, Leandro Trossard",,0,2,0,0
28-Dec-19,2019/2020,15:00,Newcastle,1,2,Everton,Steve Bruce,Carlo Ancelotti,3-5-2,4-4-2,6.91,6.95,St. James' Park,Clear,Lee Mason,"Martin Dubravka, Federico Fernández, Florian Lejeune, Fabian Schär, DeAndre Yedlin, Jetro Willems, Miguel Almirón, Isaac Hayden, Jonjo Shelvey, Joelinton, Andy Carroll, Jordan Pickford","7.5, 6.5, 6.6, 8.3, 6.5, 7.5, 6.5, 6.8, 6.5, 7.6, 8.4, 7.1","Sean Longstaff, Dwight Gayle, Christian Atsu, Javier Manquillo, Emil Krafth, Matthew Longstaff, Karl Darlow","6.0, 6.0, 6.1, 6.0, 6.0, 6.0, 6.0","Djibril Sidibé, Michael Keane, Mason Holgate, Leighton Baines, Theo Walcott, Gylfi Sigurdsson, Tom Davies, Richarlison, Moise Kean, Dominic Calvert-Lewin","7.2, 6.9, 6.5, 6.9, 6.4, 7.0, 6.6, 8.2, 6.6, 8.8","Fabian Delph, Séamus Coleman, Yerry Mina, Bernard, Lucas Digne, Maarten Stekelenburg, Cenk Tosun","6.3, 6.4, 6.2, 6.0, 6.0, 6.0, 6.0",20,22,42.7,57.3,74,78,14,9,49,24,14,15,5,8,5,7,Fabian Schär,"Dominic Calvert-Lewin, Dominic Calvert-Lewin",Andy Carroll,Richarlison,2,2,0,0
28-Dec-19,2019/2020,15:00,Southampton,1,1,Crystal Palace,Ralph Hasenhüttl,Roy Hodgson,4-4-2,4-5-1,6.79,6.88,St. Mary's Stadium,Clear,Andy Madley,"Alex McCarthy, Cédric Soares, Jan Bednarek, Jack Stephens, Ryan Bertrand, Sofiane Boufal, Pierre-Emile Højbjerg, James Ward-Prowse, Nathan Redmond, Danny Ings, Che Adams, Vicente Guaita","6.1, 6.8, 6.7, 6.6, 6.6, 6.7, 7.5, 7.7, 6.7, 7.2, 6.5, 7.3","Stuart Armstrong, Moussa Djenepo, Jannik Vestergaard, Maya Yoshida, Oriol Romeu, William Smallbone, Angus Gunn","6.0, 7.2, 6.0, 6.0, 6.0, 6.0, 6.0","Martin Kelly, Mamadou Sakho, James Tomkins, Jairo Riedewald, Max Meyer, James McCarthy, Luka Milivojevic, James McArthur, Wilfried Zaha, Jordan Ayew","5.9, 6.5, 8.7, 6.2, 6.2, 6.8, 7.7, 7.0, 7.3, 7.1","Cheikhou Kouyaté, Víctor Camarasa, James Daly, Sam Woods, Connor Wickham, Wayne Hennessey, Brandon Pierrick Keutcha","6.0, 6.0, 6.0, 6.0, 6.0, 6.0, 6.0",14,5,59.9,40.1,81,73,18,16,24,28,20,16,12,4,6,10,Danny Ings,James Tomkins,,Luka Milivojevic,1,2,0,0
28-Dec-19,2019/2020,15:00,Watford,3,0,Aston Villa,Nigel Pearson,Dean Smith,4-2-3-1,4-2-3-1,7.07,6.19,Vicarage Road,Clear,Simon Hooper,"Ben Foster, Adrian Mariappa, Christian Kabasele, Craig Cathcart, Kiko Femenía, Etienne Capoue, Will Hughes, Ismaila Sarr, Abdoulaye Doucouré, Gerard Deulofeu, Troy Deeney, Tom Heaton","6.9, 5.1, 7.5, 7.0, 6.8, 8.4, 6.8, 8.2, 7.1, 7.8, 8.9, 6.1","Craig Dawson, Nathaniel Chalobah, Adam Masina, Heurelho Gomes, Isaac Success, Domingos Quina, Andre Gray","6.3, 6.1, 6.2, 6.0, 6.0, 6.0, 6.0","Ahmed El Mohamady, Kortney Hause, Ezri Konsa Ngoyo, Matt Targett, Douglas Luiz, Conor Hourihane, Jota, Henri Lansbury, Jack Grealish, Wesley","6.4, 6.7, 5.4, 7.4, 6.2, 6.7, 6.1, 5.9, 5.9, 6.1","Jonathan Kodjia, Anwar El Ghazi, Frederic Guilbert, Trézéguet, Ørjan Nyland, Marvelous Nakamba, James Chester","6.0, 5.9, 6.0, 6.0, 6.0, 6.0, 6.0",20,11,48.8,51.2,79,81,7,10,14,22,14,11,6,3,8,5,"Troy Deeney, Troy Deeney, Ismaila Sarr",,Etienne Capoue,,5,1,1,0
28-Dec-19,2019/2020,17:30,West Ham,1,2,Leicester,Manuel Pellegrini,Brendan Rodgers,4-2-3-1,4-4-1-1,6.86,6.80,London Stadium,Clear,David Coote,"Lukasz Fabianski, Ryan Fredericks, Issa Diop, Fabián Balbuena, Arthur Masuaku, Carlos Sánchez, Declan Rice, Pablo Fornals, Manuel Lanzini, Felipe Anderson, Sébastien Haller, Kasper Schmeichel","7.3, 6.3, 6.5, 7.0, 7.1, 6.5, 6.7, 8.3, 6.4, 8.0, 7.1, 6.9","Robert Snodgrass, Michail Antonio, Albian Ajeti, Pablo Zabaleta, Winston Reid, Roberto Jiménez, Mark Noble","6.4, 6.5, 5.9, 6.0, 6.0, 6.0, 6.0","James Justin, Wes Morgan, Jonny Evans, Christian Fuchs, Demarai Gray, Nampalys Mendy, Hamza Choudhury, Marc Albrighton, Ayoze Pérez, Kelechi Iheanacho","6.6, 6.9, 7.2, 6.5, 7.2, 6.8, 6.3, 6.6, 7.6, 7.3","James Maddison, Harvey Barnes, Wilfred Ndidi, Youri Tielemans, Çaglar Söyüncü, Ben Chilwell, Danny Ward","6.8, 6.2, 6.3, 6.0, 6.0, 6.0, 6.0",14,13,42.7,57.3,71,81,20,11,25,14,24,11,5,5,4,15,Pablo Fornals,"Kelechi Iheanacho, Demarai Gray",Felipe Anderson,"Ayoze Pérez, Ayoze Pérez",4,1,0,0
28-Dec-19,2019/2020,17:30,Norwich,2,2,Tottenham,Daniel Farke,José Mourinho,4-2-3-1,3-1-4-2,6.62,6.63,Carrow Road,Clear,Kevin Friend,"Tim Krul, Max Aarons, Christoph Zimmermann, Grant Hanley, Jamal Lewis, Mario Vrancic, Alexander Tettey, Emiliano Buendía, Marco Stiepermann, Onel Hernández, Teemu Pukki, Paulo Gazzaniga","6.5, 6.6, 6.5, 7.1, 6.7, 7.8, 6.3, 7.6, 6.4, 6.3, 6.2, 5.9","Kenny McLean, Todd Cantwell, Tom Trybull, Ibrahim Amadou, Dennis Srbeny, Sam Byram, Michael McGovern","6.6, 6.1, 6.2, 6.0, 6.0, 6.0, 6.0","Juan Foyth, Toby Alderweireld, Jan Vertonghen, Tanguy Ndombele, Serge Aurier, Giovani Lo Celso, Christian Eriksen, Ryan Sessegnon, Harry Kane, Dele Alli","5.4, 6.7, 6.3, 7.2, 7.3, 6.5, 7.8, 6.6, 7.5, 6.6","Davinson Sánchez, Lucas Moura, Erik Lamela, Michel Vorm, Oliver Skipp, Japhet Tanganga, Eric Dier","6.3, 6.6, 6.2, 6.0, 6.0, 6.0, 6.0",5,15,41.1,58.9,71,81,8,14,18,19,22,22,4,6,9,11,"Mario Vrancic, Serge Aurier","Christian Eriksen, Harry Kane",,,3,3,0,0
28-Dec-19,2019/2020,19:45,Burnley,0,2,Man Utd,Sean Dyche,Ole Gunnar Solskjær,4-4-2,4-2-3-1,6.20,7.11,Turf Moor,Clear,Mike Dean,"Nick Pope, Phil Bardsley, Ben Mee, James Tarkowski, Charlie Taylor, Jeff Hendrick, Ashley Westwood, Jack Cork, Dwight McNeil, Chris Wood, Ashley Barnes, David de Gea","5.9, 7.2, 6.1, 6.4, 5.3, 5.7, 6.5, 6.2, 6.3, 6.3, 6.1, 6.9","Jay Rodriguez, Robbie Brady, Jóhann Gudmundsson, Kevin Long, Daniel Drinkwater, Matthew Lowton, Joe Hart","6.4, 6.2, 6.2, 6.0, 6.0, 6.0, 6.0","Ashley Young, Victor Lindelöf, Harry Maguire, Brandon Williams, Fred, Nemanja Matic, Daniel James, Andreas Pereira, Marcus Rashford, Anthony Martial","7.1, 7.1, 7.3, 6.8, 7.1, 7.4, 7.6, 7.2, 8.6, 7.1","Luke Shaw, Jesse Lingard, Sergio Romero, Juan Mata, Phil Jones, Aaron Wan-Bissaka, Mason Greenwood","6.2, 6.1, 6.0, 6.0, 6.0, 6.0, 6.0",8,14,38.6,61.4,68,81,7,14,21,20,13,6,5,4,5,8,,"Anthony Martial, Marcus Rashford",,"Andreas Pereira, Daniel James",4,3,0,0
29-Dec-19,2019/2020,14:00,Arsenal,1,2,Chelsea,Mikel Arteta,Frank Lampard,4-2-3-1,3-4-2-1,6.45,6.86,Emirates Stadium,Clear,Craig Pawson,"Bernd Leno, Ainsley Maitland-Niles, David Luiz, Calum Chambers, Bukayo Saka, Matteo Guendouzi, Lucas Torreira, Reiss Nelson, Mesut Özil, Pierre-Emerick Aubameyang, Alexandre Lacazette, Kepa Arrizabalaga","5.5, 7.0, 6.4, 7.0, 5.9, 6.7, 6.5, 6.3, 6.9, 7.5, 6.5, 6.0","Nicolas Pépé, Joseph Willock, Shkodran Mustafi, Emiliano Martínez, Konstantinos Mavropanos, Emile Smith Rowe, Tyreece John-Jules","5.9, 5.9, 6.3, 6.0, 6.0, 6.0, 6.0","Kurt Zouma, Antonio Rüdiger, Fikayo Tomori, César Azpilicueta, Emerson, Mateo Kovacic, N'Golo Kanté, Willian, Mason Mount, Tammy Abraham","6.4, 6.9, 5.9, 6.7, 6.0, 6.9, 7.3, 8.2, 7.3, 7.8","Tariq Lamptey, Callum Hudson-Odoi, Jorginho, Willy Caballero, Michy Batshuayi, Andreas Christensen, Ross Barkley","6.6, 6.5, 7.6, 6.0, 6.0, 6.0, 6.0",7,13,42.1,57.9,79,84,10,15,17,15,16,17,2,3,9,11,Pierre-Emerick Aubameyang,"Jorginho, Tammy Abraham",,"Mason Mount, Willian",5,4,0,0
