Date,Season,Time,TeamHome,ResultTeamHome,ResultTeamAway,TeamAway,ManagerHome,ManagerAway,FormationHome,FormationAway,RatingTeamHome,RatingTeamAway,Stadium,Weather,Referee,StartTeamHome,RatingStartTeamHome,SubstitutionHome,RatingSubstitutionHome,StartTeamAway,RatingStartTeamAway,SubstitutionAway,RatingSubstitutionAway,TotalShotsHome,TotalShotsAway,PossessionHome,PossessionAway,PassAccuracyHome,PassAccuracyAway,DribblesHome,DribblesAway,AerialsWonHome,AerialsWonAway,TacklesHome,TacklesAway,CornersHome,CornersAway,DispossessedHome,DispossessedAway,GoalsHome,GoalsAway,AssistsHome,AssistsAway,YellowCardHome,YellowCardAway,RedCardHome,RedCardAway
27-Apr-19,2018/2019,15:00,Southampton,3,3,Bournemouth,Ralph Hasenhüttl,Eddie Howe,4-3-3,5-3-2,6.91,6.62,St. Mary's Stadium,Clear,Graham Scott,"Angus Gunn, Yan Valery, Jan Bednarek, Jack Stephens, Ryan Bertrand, Pierre-Emile Højbjerg, Oriol Romeu, James Ward-Prowse, Shane Long, Danny Ings, Nathan Redmond, Artur Boruc","5.1, 7.7, 6.9, 6.1, 6.2, 8.3, 6.2, 7.8, 8.3, 7.5, 7.5, 6.5","Stuart Armstrong, Matt Targett, Charlie Austin, Mario Lemina, Fraser Forster, Josh Sims, Kayne Ramsay","5.8, 7.4, 5.9, 6.0, 6.0, 6.0, 6.0","Nathaniel Clyne, Nathan Aké, Steve Cook, Chris Mepham, Jack Simpson, Jefferson Lerma, Dan Gosling, David Brooks, Joshua King, Callum Wilson","5.9, 6.1, 6.2, 5.6, 6.5, 6.8, 6.9, 6.9, 6.7, 8.8","Ryan Fraser, Dominic Solanke, Emerson Hyndman, Asmir Begovic, Lys Mousset, Sam Surridge, Jordon Ibe","6.9, 6.4, 6.5, 6.0, 6.0, 6.0, 6.0",22,9,44.4,55.6,74,77,10,5,21,13,25,19,9,3,14,17,"Shane Long, James Ward-Prowse, Matt Targett","Dan Gosling, Callum Wilson, Callum Wilson","Nathan Redmond, Pierre-Emile Højbjerg, Yan Valery","Callum Wilson, Ryan Fraser",2,1,0,0
27-Apr-19,2018/2019,17:30,Brighton,1,1,Newcastle,Chris Hughton,Rafael Benítez,4-4-2,5-4-1,6.60,6.69,Amex Stadium,Clear,Mike Dean,"Mat Ryan, Bruno, Shane Duffy, Lewis Dunk, Bernardo, Pascal Groß, Beram Kayal, Dale Stephens, José Izquierdo, Florin Andone, Glenn Murray, Martin Dubravka","6.0, 6.5, 6.8, 6.6, 7.2, 7.4, 6.0, 6.6, 6.0, 6.0, 7.1, 6.6","Solly March, Yves Bissouma, Anthony Knockaert, Gaëtan Bong, Jürgen Locadia, David Button, Dan Burn","7.4, 6.2, 6.7, 6.0, 6.0, 6.0, 6.0","Javier Manquillo, Federico Fernández, Fabian Schär, Paul Dummett, Matt Ritchie, Ayoze Pérez, Jonjo Shelvey, Isaac Hayden, Christian Atsu, Salomón Rondón","6.6, 6.4, 7.1, 6.7, 7.0, 7.3, 6.9, 7.6, 6.6, 6.9","Ki Sung-Yueng, Yoshinori Muto, Kenedy, Antonio Barreca, Mohamed Diamé, DeAndre Yedlin, Karl Darlow","5.9, 6.0, 6.2, 6.0, 6.0, 6.0, 6.0",9,9,49.8,50.2,81,81,8,9,30,15,11,23,7,4,11,7,Pascal Groß,Ayoze Pérez,Glenn Murray,Salomón Rondón,2,3,0,0
28-Apr-19,2018/2019,12:00,Leicester,3,0,Arsenal,Brendan Rodgers,Unai Emery,4-1-4-1,4-4-2,7.54,6.26,King Power Stadium,Clear,Michael Oliver,"Kasper Schmeichel, Ricardo Pereira, Harry Maguire, Jonny Evans, Ben Chilwell, Wilfred Ndidi, Marc Albrighton, Youri Tielemans, Hamza Choudhury, James Maddison, Jamie Vardy, Bernd Leno","7.3, 8.6, 7.7, 8.0, 7.8, 7.1, 7.1, 8.1, 7.4, 8.2, 8.9, 7.7","Harvey Barnes, Demarai Gray, Nampalys Mendy, Christian Fuchs, Kelechi Iheanacho, Çaglar Söyüncü, Danny Ward","6.8, 6.2, 6.4, 6.0, 6.0, 6.0, 6.0","Ainsley Maitland-Niles, Shkodran Mustafi, Sokratis, Sead Kolasinac, Henrikh Mkhitaryan, Granit Xhaka, Lucas Torreira, Alex Iwobi, Alexandre Lacazette, Pierre-Emerick Aubameyang","4.9, 6.1, 6.1, 6.3, 6.3, 6.4, 6.5, 6.6, 6.4, 6.6","Eddie Nketiah, Matteo Guendouzi, Laurent Koscielny, Petr Cech, Mohamed Elneny, Konstantinos Mavropanos, Joseph Willock","5.7, 5.9, 6.3, 6.0, 6.0, 6.0, 6.0",24,6,67.2,32.8,84,64,13,7,21,15,19,16,8,6,8,8,"Youri Tielemans, Jamie Vardy, Jamie Vardy",,"James Maddison, Ricardo Pereira",,3,3,0,1
28-Apr-19,2018/2019,14:05,Burnley,0,1,Man City,Sean Dyche,Josep Guardiola,4-4-2,4-3-3,6.57,7.07,Turf Moor,Clear,Paul Tierney,"Tom Heaton, Matthew Lowton, Ben Mee, James Tarkowski, Charlie Taylor, Jeff Hendrick, Ashley Westwood, Jack Cork, Dwight McNeil, Chris Wood, Ashley Barnes, Ederson","7.3, 7.1, 7.2, 7.6, 6.2, 6.1, 6.4, 6.2, 6.3, 5.8, 6.8, 6.7","Jóhann Gudmundsson, Matej Vydra, Kevin Long, Stephen Ward, Ben Gibson, Anthony Driscoll-Glennon, Joe Hart","6.2, 6.3, 6.0, 6.0, 6.0, 6.0, 6.0","Kyle Walker, Vincent Kompany, Aymeric Laporte, Oleksandr Zinchenko, Ilkay Gündogan, Bernardo Silva, David Silva, Raheem Sterling, Sergio Agüero, Leroy Sané","7.2, 7.6, 8.0, 8.0, 7.0, 7.5, 6.9, 6.8, 8.2, 6.4","John Stones, Gabriel Jesus, Nicolás Otamendi, Riyad Mahrez, Danilo, Phil Foden, Arijanet Muric","6.6, 6.4, 6.0, 6.0, 6.0, 6.0, 6.0",2,25,30.1,69.9,60,86,6,11,16,26,16,13,0,6,11,7,,Sergio Agüero,,,1,1,0,0
28-Apr-19,2018/2019,16:30,Man Utd,1,1,Chelsea,Ole Gunnar Solskjær,Maurizio Sarri,4-3-1-2,4-3-3,6.53,6.69,Old Trafford,Clear,Martin Atkinson,"David de Gea, Ashley Young, Victor Lindelöf, Eric Bailly, Luke Shaw, Paul Pogba, Nemanja Matic, Ander Herrera, Juan Mata, Romelu Lukaku, Marcus Rashford, Kepa Arrizabalaga","5.5, 6.8, 6.4, 6.9, 7.2, 6.5, 7.1, 6.1, 6.9, 6.5, 6.9, 6.7","Scott McTominay, Alexis Sánchez, Marcos Rojo, Sergio Romero, Andreas Pereira, Anthony Martial, Matteo Darmian","6.2, 6.2, 6.4, 6.0, 6.0, 6.0, 6.0","César Azpilicueta, David Luiz, Antonio Rüdiger, Marcos Alonso, Mateo Kovacic, N'Golo Kanté, Jorginho, Willian, Gonzalo Higuaín, Eden Hazard","7.1, 6.4, 6.2, 7.8, 7.2, 6.7, 6.8, 6.2, 6.1, 7.6","Ruben Loftus-Cheek, Pedro, Andreas Christensen, Willy Caballero, Olivier Giroud, Davide Zappacosta, Ross Barkley","6.1, 6.9, 6.1, 6.0, 6.0, 6.0, 6.0",7,16,51.7,48.3,84,86,9,9,12,11,15,15,6,6,10,9,Juan Mata,Marcos Alonso,Luke Shaw,,3,2,0,0
02-Mar-19,2018/2019,12:30,Tottenham,1,1,Arsenal,Mauricio Pochettino,Unai Emery,3-4-1-2,4-2-3-1,6.64,6.50,Wembley Stadium,Clear,Anthony Taylor,"Hugo Lloris, Jan Vertonghen, Toby Alderweireld, Davinson Sánchez, Kieran Trippier, Moussa Sissoko, Victor Wanyama, Danny Rose, Christian Eriksen, Harry Kane, Son Heung-Min, Bernd Leno","7.4, 7.1, 6.3, 5.6, 7.9, 6.9, 5.9, 6.8, 6.2, 7.5, 6.1, 6.4","Fernando Llorente, Erik Lamela, Paulo Gazzaniga, Lucas Moura, Oliver Skipp, Ben Davies, Serge Aurier","6.3, 6.2, 6.0, 6.0, 6.0, 6.0, 6.0","Shkodran Mustafi, Laurent Koscielny, Sokratis, Nacho Monreal, Matteo Guendouzi, Granit Xhaka, Henrikh Mkhitaryan, Aaron Ramsey, Alex Iwobi, Alexandre Lacazette","6.3, 6.9, 6.2, 7.5, 6.3, 6.3, 7.0, 7.3, 7.2, 6.8","Lucas Torreira, Mesut Özil, Pierre-Emerick Aubameyang, Sead Kolasinac, Petr Cech, Denis Suárez, Ainsley Maitland-Niles","5.1, 6.1, 5.7, 6.0, 6.0, 6.0, 6.0",11,9,60.2,39.8,78,63,12,9,18,12,14,23,3,4,7,5,Harry Kane,Aaron Ramsey,,Alexandre Lacazette,3,2,0,1
02-Mar-19,2018/2019,15:00,Man Utd,3,2,Southampton,Ole Gunnar Solskjær,Ralph Hasenhüttl,4-3-1-2,3-4-2-1,6.69,6.60,Old Trafford,Clear,Stuart Attwell,"David de Gea, Ashley Young, Victor Lindelöf, Chris Smalling, Luke Shaw, Andreas Pereira, Paul Pogba, Scott McTominay, Alexis Sánchez, Romelu Lukaku, Marcus Rashford, Angus Gunn","5.5, 7.0, 6.5, 7.0, 7.0, 7.5, 6.1, 6.9, 6.0, 8.9, 6.5, 7.1","Diogo Dalot, Tahith Chong, Fred, Marcos Rojo, Lee Grant, Angel Gomes, Eric Bailly","6.8, 6.0, 6.2, 6.0, 6.0, 6.0, 6.0","Jannik Vestergaard, Maya Yoshida, Jan Bednarek, Yan Valery, Ryan Bertrand, Pierre-Emile Højbjerg, Oriol Romeu, Nathan Redmond, James Ward-Prowse, Charlie Austin","7.0, 6.6, 6.1, 7.2, 6.0, 6.7, 7.2, 6.5, 7.3, 6.3","Stuart Armstrong, Sam Gallagher, Mohamed Elyounoussi, Jack Stephens, Alex McCarthy, Matt Targett, Callum Slattery","5.8, 6.0, 6.0, 6.0, 6.0, 6.0, 6.0",16,9,64.2,35.8,80,65,9,6,28,13,9,20,9,7,15,7,"Andreas Pereira, Romelu Lukaku, Romelu Lukaku","Yan Valery, James Ward-Prowse","Diogo Dalot, Andreas Pereira",Charlie Austin,2,1,0,0
02-Mar-19,2018/2019,15:00,Bournemouth,0,1,Man City,Eddie Howe,Josep Guardiola,5-4-1,4-3-3,6.46,6.88,Vitality Stadium,Clear,Kevin Friend,"Artur Boruc, Nathaniel Clyne, Nathan Aké, Jack Simpson, Chris Mepham, Charlie Daniels, Adam Smith, Andrew Surman, David Brooks, Ryan Fraser, Joshua King, Ederson","8.0, 6.6, 6.9, 6.5, 7.1, 6.5, 6.5, 6.3, 6.4, 5.9, 5.6, 6.6","Jordon Ibe, Diego Rico, Lys Mousset, Asmir Begovic, Kyle Taylor, Sam Surridge, Dan Gosling","6.1, 6.1, 6.1, 6.0, 6.0, 6.0, 6.0","Kyle Walker, Nicolás Otamendi, John Stones, Oleksandr Zinchenko, Kevin De Bruyne, Ilkay Gündogan, David Silva, Bernardo Silva, Sergio Agüero, Raheem Sterling","6.7, 7.4, 6.9, 6.8, 6.7, 7.1, 8.0, 7.1, 6.8, 6.5","Gabriel Jesus, Vincent Kompany, Riyad Mahrez, Danilo, Leroy Sané, Phil Foden, Arijanet Muric","6.0, 6.2, 7.5, 6.0, 6.0, 6.0, 6.0",0,23,18,82,57,91,4,6,9,13,14,9,0,14,9,5,,Riyad Mahrez,,David Silva,1,2,0,0
02-Mar-19,2018/2019,15:00,Brighton,1,0,Huddersfield,Chris Hughton,Jan Siewert,4-3-3,4-1-2-1-2,7.05,6.48,Amex Stadium,Clear,Mike Dean,"Mat Ryan, Martín Montoya, Shane Duffy, Lewis Dunk, Bernardo, Yves Bissouma, Davy Pröpper, Dale Stephens, Anthony Knockaert, Glenn Murray, Alireza Jahanbakhsh, Jonas Lössl","7.4, 7.4, 8.5, 6.9, 7.8, 7.1, 7.3, 7.1, 8.0, 5.5, 6.7, 6.6","Florin Andone, Beram Kayal, José Izquierdo, Gaëtan Bong, Solly March, Dan Burn, David Button","6.8, 6.1, 6.3, 6.0, 6.0, 6.0, 6.0","Juninho Bacuna, Christopher Schindler, Terence Kongolo, Erik Durm, Jon Gorenc Stankovic, Philip Billing, Jonathan Hogg, Alex Pritchard, Steve Mounie, Karlan Grant","6.5, 6.5, 7.2, 6.3, 7.2, 6.9, 6.4, 6.4, 6.4, 6.1","Florent Hadergjonaj, Elias Kachunga, Aaron Mooy, Zanka, Chris Löwe, Ben Hamer, Matty Daly","6.3, 5.9, 6.3, 6.0, 6.0, 6.0, 6.0",14,6,52.7,47.3,81,77,11,2,24,20,22,21,6,3,7,12,Florin Andone,,Anthony Knockaert,,2,2,0,0
02-Mar-19,2018/2019,15:00,Burnley,1,3,Crystal Palace,Sean Dyche,Roy Hodgson,4-4-2,4-5-1,6.33,6.94,Turf Moor,Clear,Lee Probert,"Tom Heaton, Phil Bardsley, Ben Mee, James Tarkowski, Charlie Taylor, Jeff Hendrick, Jack Cork, Ashley Westwood, Dwight McNeil, Chris Wood, Ashley Barnes, Wayne Hennessey","6.0, 5.8, 6.5, 6.5, 6.4, 5.7, 6.1, 7.5, 6.1, 6.3, 6.8, 7.0","Peter Crouch, Robbie Brady, Jóhann Gudmundsson, Matej Vydra, Ben Gibson, Matthew Lowton, Joe Hart","6.3, 6.3, 6.4, 6.0, 6.0, 6.0, 6.0","Aaron Wan-Bissaka, James Tomkins, Scott Dann, Patrick van Aanholt, Wilfried Zaha, Max Meyer, Cheikhou Kouyaté, Luka Milivojevic, Jeffrey Schlupp, Michy Batshuayi","8.1, 6.9, 7.1, 6.7, 8.2, 6.5, 7.1, 6.7, 7.4, 7.4","James McArthur, Andros Townsend, Christian Benteke, Jordan Ayew, Vicente Guaita, Joel Ward, Martin Kelly","6.1, 6.3, 5.8, 6.0, 6.0, 6.0, 6.0",18,10,56.3,43.7,75,66,3,12,29,27,16,17,8,5,11,9,Ashley Barnes,"Phil Bardsley, Michy Batshuayi, Wilfried Zaha",Ashley Westwood,"Aaron Wan-Bissaka, Cheikhou Kouyaté",1,2,0,0
02-Mar-19,2018/2019,15:00,Wolves,2,0,Cardiff,Nuno Espírito Santo,Neil Warnock,3-5-2,4-1-2-1-2,7.49,6.30,Molineux Stadium,Clear,Andre Marriner,"John Ruddy, Willy Boly, Conor Coady, Ryan Bennett, Adama Traoré, Rúben Vinagre, Leander Dendoncker, Romain Saïss, Morgan Gibbs-White, Raúl Jiménez, Diogo Jota, Neil Etheridge","7.2, 7.9, 6.8, 7.5, 7.3, 7.6, 7.9, 8.8, 6.8, 8.5, 8.6, 6.7","João Moutinho, Ivan Cavaleiro, Matt Doherty, Rúben Neves, Hélder Costa, Jonny, Will Norris","6.4, 6.0, 7.6, 6.0, 6.0, 6.0, 6.0","Lee Peltier, Sean Morrison, Sol Bamba, Joe Bennett, Aron Gunnarsson, Víctor Camarasa, Joe Ralls, Bobby De Cordova-Reid, Kenneth Zohore, Oumar Niasse","6.1, 7.1, 5.3, 6.8, 6.3, 6.6, 6.4, 6.3, 6.2, 6.2","Rhys Healey, Callum Paterson, Bruno Ecuele Manga, Harry Arter, Leandro Bacuna, Alex Smithies, Kadeem Harris","6.0, 6.0, 6.2, 6.0, 6.0, 6.0, 6.0",13,12,56.3,43.7,80,68,16,7,41,20,20,17,7,8,9,10,"Diogo Jota, Raúl Jiménez",,"Raúl Jiménez, Diogo Jota",,1,2,0,0
02-Mar-19,2018/2019,17:30,West Ham,2,0,Newcastle,Manuel Pellegrini,Rafael Benítez,4-1-4-1,5-4-1,7.23,6.16,London Stadium,,Chris Kavanagh,"Lukasz Fabianski, Ryan Fredericks, Issa Diop, Angelo Ogbonna, Aaron Cresswell, Declan Rice, Robert Snodgrass, Manuel Lanzini, Mark Noble, Felipe Anderson, Chicharito, Martin Dubravka","7.5, 7.4, 7.6, 7.7, 6.6, 8.5, 7.8, 6.8, 7.2, 7.3, 6.9, 5.8","Pedro Obiang, Arthur Masuaku, Marko Arnautovic, Samir Nasri, Adrián, Lucas Pérez, Michail Antonio","6.4, 7.3, 6.3, 6.0, 6.0, 6.0, 6.0","Javier Manquillo, Florian Lejeune, Fabian Schär, Jamaal Lascelles, Matt Ritchie, Ayoze Pérez, Isaac Hayden, Sean Longstaff, Miguel Almirón, Salomón Rondón","6.3, 5.9, 5.8, 5.9, 6.3, 5.9, 6.1, 5.9, 6.5, 7.0","Paul Dummett, Mohamed Diamé, Christian Atsu, Yoshinori Muto, DeAndre Yedlin, Karl Darlow, Ki Sung-Yueng","6.2, 6.5, 6.2, 6.0, 6.0, 6.0, 6.0",10,17,55.8,44.2,83,79,15,7,17,5,26,21,1,6,17,14,"Declan Rice, Mark Noble",,Robert Snodgrass,,3,4,0,0
03-Mar-19,2018/2019,12:00,Watford,2,1,Leicester,Javier Gracia,Brendan Rodgers,4-2-2-2,3-4-2-1,6.81,6.57,Vicarage Road,Clear,Jonathan Moss,"Ben Foster, Daryl Janmaat, Adrian Mariappa, Craig Cathcart, José Holebas, Etienne Capoue, Abdoulaye Doucouré, Roberto Pereyra, Will Hughes, Gerard Deulofeu, Troy Deeney, Kasper Schmeichel","6.0, 6.8, 7.0, 6.6, 6.6, 7.6, 7.0, 6.7, 7.0, 6.9, 7.9, 6.4","Andre Gray, Tom Cleverley, Christian Kabasele, Heurelho Gomes, Adam Masina, Isaac Success, Domingos Quina","6.6, 6.1, 6.0, 6.0, 6.0, 6.0, 6.0","Wes Morgan, Harry Maguire, Jonny Evans, Ricardo Pereira, Ben Chilwell, Youri Tielemans, Wilfred Ndidi, Harvey Barnes, James Maddison, Jamie Vardy","7.1, 6.6, 6.5, 6.8, 6.6, 6.9, 7.4, 5.9, 6.9, 7.0","Demarai Gray, Kelechi Iheanacho, Nampalys Mendy, Rachid Ghezzal, Christian Fuchs, Çaglar Söyüncü, Danny Ward","6.0, 6.1, 5.9, 6.0, 6.0, 6.0, 6.0",6,14,39,61,78,84,5,9,19,21,15,13,1,5,7,11,"Troy Deeney, Andre Gray",Jamie Vardy,"Gerard Deulofeu, Troy Deeney",Youri Tielemans,5,1,0,0
03-Mar-19,2018/2019,14:05,Fulham,1,2,Chelsea,Scott Parker,Maurizio Sarri,4-2-3-1,4-3-3,6.57,6.98,Craven Cottage,Clear,Graham Scott,"Sergio Rico, Denis Odoi, Håvard Nordtveit, Tim Ream, Joe Bryan, Calum Chambers, Kevin McDonald, Ryan Babel, Tom Cairney, Ryan Sessegnon, Aleksandar Mitrovic, Kepa Arrizabalaga","6.7, 6.2, 6.5, 6.4, 6.7, 7.4, 6.3, 7.3, 7.1, 6.3, 6.5, 7.4","Floyd Ayité, André-Frank Zambo Anguissa, Luciano Vietto, Maxime Le Marchand, Cyrus Christie, Fabri, Jean Michael Seri","6.1, 6.4, 6.1, 6.0, 6.0, 6.0, 6.0","César Azpilicueta, Andreas Christensen, Antonio Rüdiger, Emerson, N'Golo Kanté, Jorginho, Ross Barkley, Willian, Gonzalo Higuaín, Eden Hazard","7.5, 6.5, 6.7, 6.4, 7.3, 7.7, 7.0, 7.2, 7.6, 7.7","Ruben Loftus-Cheek, Pedro, Mateo Kovacic, Willy Caballero, David Luiz, Olivier Giroud, Callum Hudson-Odoi","6.4, 6.0, 6.4, 6.0, 6.0, 6.0, 6.0",12,20,36,64,80,90,10,6,3,9,14,15,5,4,11,11,Calum Chambers,"Gonzalo Higuaín, Jorginho",Ryan Babel,"César Azpilicueta, Eden Hazard",2,1,0,0
03-Mar-19,2018/2019,16:15,Everton,0,0,Liverpool,Marco Silva,Jürgen Klopp,4-4-1-1,4-3-3,6.91,6.91,Goodison Park,Clear,Martin Atkinson,"Jordan Pickford, Séamus Coleman, Kurt Zouma, Michael Keane, Lucas Digne, Theo Walcott, Morgan Schneiderlin, Idrissa Gueye, Bernard, Gylfi Sigurdsson, Dominic Calvert-Lewin, Alisson","6.7, 7.2, 7.0, 8.2, 7.9, 6.3, 7.2, 7.4, 6.6, 7.1, 6.7, 7.4","Cenk Tosun, André Gomes, Richarlison, Maarten Stekelenburg, Phil Jagielka, Jonjoe Kenny, Tom Davies","6.2, 6.1, 6.3, 6.0, 6.0, 6.0, 6.0","Trent Alexander-Arnold, Joel Matip, Virgil van Dijk, Andrew Robertson, Fabinho, Georginio Wijnaldum, Jordan Henderson, Mohamed Salah, Sadio Mané, Divock Origi","8.0, 7.6, 8.6, 7.4, 6.7, 6.3, 7.2, 6.5, 6.3, 6.2","Adam Lallana, James Milner, Roberto Firmino, Simon Mignolet, Naby Keita, Xherdan Shaqiri, Daniel Sturridge","6.2, 6.5, 6.0, 6.0, 6.0, 6.0, 6.0",7,10,42.2,57.8,63,76,10,10,29,34,19,18,3,7,9,17,,,,,1,2,0,0
09-Mar-19,2018/2019,12:30,Crystal Palace,1,2,Brighton,Roy Hodgson,Chris Hughton,4-3-3,4-5-1,6.45,6.80,Selhurst Park,,Craig Pawson,"Vicente Guaita, Aaron Wan-Bissaka, James Tomkins, Scott Dann, Patrick van Aanholt, Jeffrey Schlupp, Luka Milivojevic, James McArthur, Andros Townsend, Michy Batshuayi, Wilfried Zaha, Mat Ryan","5.7, 6.7, 5.8, 6.1, 6.4, 6.9, 7.3, 6.4, 7.1, 6.5, 6.7, 6.4","Max Meyer, Christian Benteke, Julian Speroni, Jordan Ayew, Cheikhou Kouyaté, Joel Ward, Martin Kelly","6.2, 6.2, 6.0, 6.0, 6.0, 6.0, 6.0","Martín Montoya, Shane Duffy, Lewis Dunk, Bernardo, Anthony Knockaert, Yves Bissouma, Davy Pröpper, Dale Stephens, Alireza Jahanbakhsh, Glenn Murray","6.9, 6.3, 7.2, 7.4, 7.3, 6.2, 6.5, 8.0, 6.6, 7.6","Solly March, Jürgen Locadia, Gaëtan Bong, José Izquierdo, Beram Kayal, Dan Burn, David Button","6.1, 6.0, 6.0, 6.0, 6.0, 6.0, 6.0",15,4,62.7,37.3,82,72,10,3,11,14,28,26,8,0,13,15,Luka Milivojevic,"Glenn Murray, Anthony Knockaert",,"Lewis Dunk, Dale Stephens",1,5,0,0
09-Mar-19,2018/2019,15:00,Southampton,2,1,Tottenham,Ralph Hasenhüttl,Mauricio Pochettino,3-4-2-1,4-1-2-1-2,6.85,6.56,St. Mary's Stadium,,Kevin Friend,"Angus Gunn, Jannik Vestergaard, Maya Yoshida, Jan Bednarek, Yan Valery, Ryan Bertrand, Pierre-Emile Højbjerg, Oriol Romeu, Nathan Redmond, James Ward-Prowse, Charlie Austin, Hugo Lloris","6.6, 6.9, 6.8, 7.7, 7.0, 6.9, 7.2, 6.1, 7.1, 7.6, 6.2, 5.6","Stuart Armstrong, Josh Sims, Shane Long, Jack Stephens, Alex McCarthy, Matt Targett, Callum Slattery","7.0, 6.7, 6.2, 6.0, 6.0, 6.0, 6.0","Kyle Walker-Peters, Jan Vertonghen, Davinson Sánchez, Danny Rose, Eric Dier, Christian Eriksen, Moussa Sissoko, Dele Alli, Lucas Moura, Harry Kane","7.2, 6.1, 6.7, 6.5, 6.4, 7.7, 6.3, 6.9, 6.8, 7.6","Son Heung-Min, Ben Davies, Fernando Llorente, Erik Lamela, Paulo Gazzaniga, Juan Foyth, Victor Wanyama","5.8, 6.1, 6.2, 6.0, 6.0, 6.0, 6.0",12,16,36.8,63.2,70,76,8,16,15,17,15,17,1,10,12,6,"Yan Valery, James Ward-Prowse",Harry Kane,Stuart Armstrong,Dele Alli,4,2,0,0
09-Mar-19,2018/2019,15:00,Newcastle,3,2,Everton,Rafael Benítez,Marco Silva,3-4-3,4-2-3-1,6.83,6.52,St. James' Park,Clear,Lee Mason,"Martin Dubravka, Florian Lejeune, Fabian Schär, Jamaal Lascelles, DeAndre Yedlin, Matt Ritchie, Isaac Hayden, Ki Sung-Yueng, Ayoze Pérez, Salomón Rondón, Miguel Almirón, Jordan Pickford","5.3, 6.5, 6.6, 6.1, 6.2, 6.5, 7.6, 5.9, 9.3, 8.3, 7.1, 5.9","Paul Dummett, Jonjo Shelvey, Kenedy, Mohamed Diamé, Javier Manquillo, Joselu, Karl Darlow","7.2, 6.5, 6.3, 6.0, 6.0, 6.0, 6.0","Jonjoe Kenny, Kurt Zouma, Michael Keane, Lucas Digne, André Gomes, Idrissa Gueye, Richarlison, Gylfi Sigurdsson, Bernard, Dominic Calvert-Lewin","6.4, 6.8, 5.9, 7.1, 6.1, 6.8, 7.7, 6.1, 6.1, 8.0","Ademola Lookman, Theo Walcott, Yerry Mina, Morgan Schneiderlin, Maarten Stekelenburg, Cenk Tosun, Tom Davies","6.1, 6.0, 6.2, 6.0, 6.0, 6.0, 6.0",19,7,45.5,54.5,70,75,7,6,18,29,22,20,8,2,12,14,"Salomón Rondón, Ayoze Pérez, Ayoze Pérez","Dominic Calvert-Lewin, Richarlison",Ayoze Pérez,Lucas Digne,3,1,0,0
09-Mar-19,2018/2019,15:00,Leicester,3,1,Fulham,Brendan Rodgers,Scott Parker,4-3-3,4-3-3,7.13,6.37,King Power Stadium,Clear,David Coote,"Kasper Schmeichel, Ricardo Pereira, Harry Maguire, Jonny Evans, Ben Chilwell, Youri Tielemans, Wilfred Ndidi, James Maddison, Demarai Gray, Jamie Vardy, Harvey Barnes, Sergio Rico","6.6, 7.3, 7.1, 7.2, 7.2, 7.5, 8.1, 7.3, 6.2, 9.0, 7.6, 6.7","Shinji Okazaki, Nampalys Mendy, Rachid Ghezzal, Christian Fuchs, Wes Morgan, Kelechi Iheanacho, Danny Ward","6.2, 6.3, 6.4, 6.0, 6.0, 6.0, 6.0","Denis Odoi, Håvard Nordtveit, Tim Ream, Joe Bryan, Calum Chambers, Tom Cairney, Kevin McDonald, Ryan Babel, Aleksandar Mitrovic, Ryan Sessegnon","7.0, 5.7, 6.1, 7.1, 5.7, 6.0, 6.7, 6.3, 6.6, 5.9","Jean Michael Seri, Floyd Ayité, Luciano Vietto, André-Frank Zambo Anguissa, Maxime Le Marchand, Cyrus Christie, Fabri","6.1, 7.4, 6.0, 6.0, 6.0, 6.0, 6.0",18,6,52.8,47.2,85,81,6,9,16,7,24,26,6,5,16,21,"Youri Tielemans, Jamie Vardy, Jamie Vardy",Floyd Ayité,"Jamie Vardy, James Maddison, Harvey Barnes",Håvard Nordtveit,0,2,0,0
09-Mar-19,2018/2019,15:00,Huddersfield,0,2,Bournemouth,Jan Siewert,Eddie Howe,4-1-2-1-2,4-4-2,6.37,7.11,John Smith's Stadium,Clear,Anthony Taylor,"Jonas Lössl, Juninho Bacuna, Zanka, Christopher Schindler, Erik Durm, Philip Billing, Jon Gorenc Stankovic, Elias Kachunga, Alex Pritchard, Aaron Mooy, Steve Mounie, Artur Boruc","6.6, 7.0, 7.2, 6.0, 5.6, 6.1, 7.0, 5.7, 7.0, 6.8, 6.1, 6.7","Karlan Grant, Aaron Rowe, Chris Löwe, Matty Daly, Ben Hamer, Jason Puncheon, Florent Hadergjonaj","6.0, 6.0, 6.0, 6.0, 6.0, 6.0, 6.0","Adam Smith, Nathan Aké, Chris Mepham, Charlie Daniels, David Brooks, Jefferson Lerma, Andrew Surman, Ryan Fraser, Joshua King, Callum Wilson","6.6, 7.5, 7.1, 7.4, 6.5, 7.8, 7.0, 8.8, 7.3, 7.7","Nathaniel Clyne, Dominic Solanke, Lys Mousset, Asmir Begovic, Diego Rico, Sam Surridge, Jack Simpson","6.7, 6.5, 6.2, 6.0, 6.0, 6.0, 6.0",8,8,56.5,43.5,79,70,12,11,20,11,18,19,6,5,11,9,,"Callum Wilson, Ryan Fraser",,"Ryan Fraser, Callum Wilson",3,1,0,0
09-Mar-19,2018/2019,15:00,Cardiff,2,0,West Ham,Neil Warnock,Manuel Pellegrini,4-2-3-1,4-1-4-1,7.06,6.37,Cardiff City Stadium,Clear,Graham Scott,"Neil Etheridge, Lee Peltier, Bruno Ecuele Manga, Sean Morrison, Joe Bennett, Aron Gunnarsson, Harry Arter, Josh Murphy, Víctor Camarasa, David Junior Hoilett, Oumar Niasse, Lukasz Fabianski","7.0, 7.4, 6.9, 6.9, 7.1, 7.8, 6.7, 7.8, 7.5, 7.7, 7.1, 7.1","Callum Paterson, Joe Ralls, Leandro Bacuna, Kenneth Zohore, Alex Smithies, Bobby De Cordova-Reid, Kadeem Harris","6.1, 6.2, 6.7, 6.0, 6.0, 6.0, 6.0","Ryan Fredericks, Issa Diop, Angelo Ogbonna, Aaron Cresswell, Declan Rice, Robert Snodgrass, Manuel Lanzini, Mark Noble, Felipe Anderson, Chicharito","5.8, 6.8, 6.9, 6.8, 6.9, 6.0, 6.1, 6.0, 6.5, 5.9","Michail Antonio, Samir Nasri, Marko Arnautovic, Arthur Masuaku, Fabián Balbuena, Pedro Obiang, Adrián","6.2, 6.1, 6.1, 6.0, 6.0, 6.0, 6.0",16,9,29.3,70.7,65,81,7,8,17,17,13,21,7,5,13,8,"David Junior Hoilett, Víctor Camarasa",,Josh Murphy,,2,1,0,0
09-Mar-19,2018/2019,17:30,Man City,3,1,Watford,Josep Guardiola,Javier Gracia,4-3-3,4-5-1,6.99,6.39,Etihad Stadium,Clear,Paul Tierney,"Ederson, Kyle Walker, Nicolás Otamendi, Vincent Kompany, Oleksandr Zinchenko, Ilkay Gündogan, Bernardo Silva, David Silva, Riyad Mahrez, Sergio Agüero, Raheem Sterling, Ben Foster","5.9, 6.4, 6.5, 6.7, 6.6, 7.5, 7.3, 8.2, 8.5, 6.7, 9.4, 6.3","Phil Foden, Leroy Sané, Gabriel Jesus, Danilo, Aymeric Laporte, Fabian Delph, Arijanet Muric","6.0, 5.9, 6.2, 6.0, 6.0, 6.0, 6.0","Daryl Janmaat, Christian Kabasele, Miguel Britos, Adam Masina, Kiko Femenía, Etienne Capoue, Abdoulaye Doucouré, Tom Cleverley, Isaac Success, Andre Gray","6.5, 6.7, 6.2, 6.3, 5.8, 7.4, 5.9, 5.8, 6.2, 6.3","Craig Cathcart, Troy Deeney, Gerard Deulofeu, Heurelho Gomes, José Holebas, Domingos Quina, Ken Sema","6.0, 7.2, 6.9, 6.0, 6.0, 6.0, 6.0",19,2,71.1,28.9,91,70,10,9,17,12,7,18,9,1,6,4,"Raheem Sterling, Raheem Sterling, Raheem Sterling",Gerard Deulofeu,"Riyad Mahrez, David Silva",Troy Deeney,1,1,0,0
10-Mar-19,2018/2019,12:00,Liverpool,4,2,Burnley,Jürgen Klopp,Sean Dyche,4-3-3,4-4-2,6.97,6.46,Anfield,Clear,Andre Marriner,"Alisson, Trent Alexander-Arnold, Joel Matip, Virgil van Dijk, Andrew Robertson, Fabinho, Georginio Wijnaldum, Adam Lallana, Mohamed Salah, Roberto Firmino, Sadio Mané, Tom Heaton","6.0, 6.8, 7.0, 7.6, 6.6, 6.8, 6.7, 7.1, 6.7, 8.7, 8.5, 4.8","Daniel Sturridge, Jordan Henderson, Naby Keita, Simon Mignolet, Divock Origi, Dejan Lovren, Xherdan Shaqiri","6.7, 6.2, 6.2, 6.0, 6.0, 6.0, 6.0","Phil Bardsley, Ben Mee, James Tarkowski, Charlie Taylor, Jeff Hendrick, Ashley Westwood, Jack Cork, Dwight McNeil, Chris Wood, Ashley Barnes","6.3, 6.4, 7.2, 7.3, 6.0, 7.0, 6.7, 6.3, 6.3, 6.6","Peter Crouch, Jóhann Gudmundsson, Matej Vydra, Robbie Brady, Joe Hart, Matthew Lowton, Ben Gibson","6.1, 6.9, 6.5, 6.0, 6.0, 6.0, 6.0",23,3,68.6,31.4,81,62,7,10,20,27,21,27,7,2,14,12,"Roberto Firmino, Sadio Mané, Roberto Firmino, Sadio Mané","Ashley Westwood, Jóhann Gudmundsson",Daniel Sturridge,Matej Vydra,2,0,0,0
10-Mar-19,2018/2019,14:05,Chelsea,1,1,Wolves,Maurizio Sarri,Nuno Espírito Santo,4-3-3,3-5-2,6.67,6.91,Stamford Bridge,Clear,Michael Oliver,"Kepa Arrizabalaga, César Azpilicueta, David Luiz, Antonio Rüdiger, Emerson, Mateo Kovacic, N'Golo Kanté, Jorginho, Pedro, Gonzalo Higuaín, Eden Hazard, Rui Patrício","5.9, 6.3, 6.2, 6.1, 7.3, 6.3, 6.7, 6.4, 6.8, 6.9, 8.3, 7.0","Callum Hudson-Odoi, Ruben Loftus-Cheek, Willian, Willy Caballero, Andreas Christensen, Olivier Giroud, Ross Barkley","6.5, 6.9, 6.7, 6.0, 6.0, 6.0, 6.0","Willy Boly, Romain Saïss, Conor Coady, Matt Doherty, Jonny, Leander Dendoncker, Rúben Neves, João Moutinho, Raúl Jiménez, Diogo Jota","7.4, 7.2, 6.5, 7.0, 6.3, 7.7, 7.0, 6.8, 7.7, 7.5","Morgan Gibbs-White, Adama Traoré, Ivan Cavaleiro, Rúben Vinagre, Hélder Costa, John Ruddy, Maximilian Kilman","5.9, 5.9, 6.0, 6.0, 6.0, 6.0, 6.0",22,2,75.6,24.4,90,71,21,4,8,12,14,34,13,0,19,8,Eden Hazard,Raúl Jiménez,Willian,Diogo Jota,1,4,0,0
10-Mar-19,2018/2019,16:30,Arsenal,2,0,Man Utd,Unai Emery,Ole Gunnar Solskjær,3-4-1-2,4-4-2,6.94,6.43,Emirates Stadium,,Jonathan Moss,"Bernd Leno, Laurent Koscielny, Sokratis, Nacho Monreal, Ainsley Maitland-Niles, Granit Xhaka, Aaron Ramsey, Sead Kolasinac, Mesut Özil, Alexandre Lacazette, Pierre-Emerick Aubameyang, David de Gea","7.4, 6.9, 7.3, 7.0, 7.5, 8.1, 7.3, 6.4, 6.7, 7.0, 7.0, 4.6","Eddie Nketiah, Denis Suárez, Alex Iwobi, Petr Cech, Mohamed Elneny, Matteo Guendouzi, Shkodran Mustafi","6.2, 6.2, 6.2, 6.0, 6.0, 6.0, 6.0","Ashley Young, Victor Lindelöf, Chris Smalling, Luke Shaw, Diogo Dalot, Fred, Nemanja Matic, Paul Pogba, Romelu Lukaku, Marcus Rashford","6.7, 6.5, 6.6, 7.2, 6.4, 6.6, 6.5, 6.4, 7.0, 6.7","Mason Greenwood, Anthony Martial, Sergio Romero, Marcos Rojo, Andreas Pereira, Scott McTominay, Eric Bailly","6.0, 6.3, 6.0, 6.0, 6.0, 6.0, 6.0",14,14,46.1,53.9,76,81,4,8,9,25,17,20,5,2,15,11,"Granit Xhaka, Pierre-Emerick Aubameyang",,Alexandre Lacazette,,2,2,0,0
