Date,Season,Time,TeamHome,ResultTeamHome,ResultTeamAway,TeamAway,ManagerHome,ManagerAway,FormationHome,FormationAway,RatingTeamHome,RatingTeamAway,Stadium,Weather,Referee,StartTeamHome,RatingStartTeamHome,SubstitutionHome,RatingSubstitutionHome,StartTeamAway,RatingStartTeamAway,SubstitutionAway,RatingSubstitutionAway,TotalShotsHome,TotalShotsAway,PossessionHome,PossessionAway,PassAccuracyHome,PassAccuracyAway,DribblesHome,DribblesAway,AerialsWonHome,AerialsWonAway,TacklesHome,TacklesAway,CornersHome,CornersAway,DispossessedHome,DispossessedAway,GoalsHome,GoalsAway,AssistsHome,AssistsAway,YellowCardHome,YellowCardAway,RedCardHome,RedCardAway
09-Aug-19,2019/2020,20:00,Liverpool,4,1,Norwich,Jürgen Klopp,Daniel Farke,4-3-3,4-2-3-1,7.25,6.36,Anfield,Clear,Michael Oliver,"Alisson, Trent Alexander-Arnold, Virgil van Dijk, Joseph Gomez, Andrew Robertson, Fabinho, Georginio Wijnaldum, Jordan Henderson, Mohamed Salah, Roberto Firmino, Divock Origi, Tim Krul","6.5, 7.7, 8.5, 6.8, 6.7, 8.0, 6.7, 7.3, 8.3, 8.5, 8.1, 6.6","James Milner, Adrián, Sadio Mané, Joel Matip, Naby Keita, Xherdan Shaqiri, Alex Oxlade-Chamberlain","6.0, 6.4, 6.1, 6.0, 6.0, 6.0, 6.0","Max Aarons, Ben Godfrey, Grant Hanley, Jamal Lewis, Tom Trybull, Kenny McLean, Emiliano Buendía, Marco Stiepermann, Todd Cantwell, Teemu Pukki","6.8, 6.7, 5.0, 6.5, 6.2, 6.1, 7.3, 5.8, 6.4, 7.0","Josip Drmic, Onel Hernández, Moritz Leitner, Mario Vrancic, Ralf Fährmann, Sam Byram, Patrick Roberts","6.0, 6.2, 6.4, 6.0, 6.0, 6.0, 6.0",15,12,57.9,42.1,81,77,11,10,15,7,21,12,11,2,8,15,"Grant Hanley, Mohamed Salah, Virgil van Dijk, Divock Origi",Teemu Pukki,"Roberto Firmino, Mohamed Salah, Trent Alexander-Arnold",Emiliano Buendía,0,2,0,0
10-Aug-19,2019/2020,12:30,West Ham,0,5,Man City,Manuel Pellegrini,Josep Guardiola,4-2-3-1,4-3-3,5.89,7.73,London Stadium,Clear,Mike Dean,"Lukasz Fabianski, Ryan Fredericks, Issa Diop, Fabián Balbuena, Aaron Cresswell, Declan Rice, Jack Wilshere, Felipe Anderson, Manuel Lanzini, Michail Antonio, Sébastien Haller, Ederson","6.2, 5.9, 4.9, 5.3, 5.3, 6.2, 6.1, 5.7, 6.3, 6.4, 6.6, 7.7","Robert Snodgrass, Pablo Fornals, Chicharito, Pablo Zabaleta, Carlos Sánchez, Angelo Ogbonna, Roberto Jiménez","6.0, 5.9, 5.7, 6.0, 6.0, 6.0, 6.0","Kyle Walker, Aymeric Laporte, John Stones, Oleksandr Zinchenko, Kevin De Bruyne, Rodrigo, David Silva, Riyad Mahrez, Gabriel Jesus, Raheem Sterling","7.7, 7.9, 7.5, 7.5, 8.7, 7.8, 6.9, 9.8, 7.8, 9.6","Phil Foden, Ilkay Gündogan, Sergio Agüero, Nicolás Otamendi, Claudio Bravo, João Cancelo, Bernardo Silva","6.3, 6.3, 6.8, 6.0, 6.0, 6.0, 6.0",5,14,42.9,57.1,81,86,8,13,18,17,18,18,1,1,14,13,,"Gabriel Jesus, Raheem Sterling, Raheem Sterling, Sergio Agüero, Raheem Sterling",,"Kyle Walker, Kevin De Bruyne, Riyad Mahrez, Riyad Mahrez",2,2,0,0
10-Aug-19,2019/2020,15:00,Bournemouth,1,1,Sheff Utd,Eddie Howe,Chris Wilder,3-4-2-1,3-5-2,6.67,6.54,Vitality Stadium,Clear,Kevin Friend,"Aaron Ramsdale, Nathan Aké, Steve Cook, Chris Mepham, Adam Smith, Diego Rico, Jefferson Lerma, Philip Billing, Joshua King, Ryan Fraser, Callum Wilson, Dean Henderson","6.3, 7.1, 6.5, 7.5, 6.3, 7.1, 6.7, 7.4, 6.9, 6.3, 6.0, 6.1","Dominic Solanke, Artur Boruc, Andrew Surman, Jack Simpson, Jordon Ibe, Charlie Daniels, Harry Wilson","6.0, 6.0, 6.0, 6.0, 6.0, 6.0, 6.0","John Egan, Chris Basham, Jack O'Connell, George Baldock, Enda Stevens, John Lundstram, John Fleck, Oliver Norwood, David McGoldrick, Callum Robinson","7.2, 6.5, 7.0, 5.9, 6.5, 6.6, 6.3, 7.0, 6.5, 6.6","Oliver McBurnie, Luke Freeman, Billy Sharp, Muhamed Besic, Phil Jagielka, Ben Osborn, Simon Moore","6.2, 6.3, 6.9, 6.0, 6.0, 6.0, 6.0",13,8,52.9,47.1,79,78,8,6,14,21,18,14,3,4,5,9,Chris Mepham,Billy Sharp,,,2,1,0,0
10-Aug-19,2019/2020,15:00,Burnley,3,0,Southampton,Sean Dyche,Ralph Hasenhüttl,4-4-2,3-4-2-1,7.41,6.02,Turf Moor,Clear,Graham Scott,"Nick Pope, Matthew Lowton, Ben Mee, James Tarkowski, Erik Pieters, Jóhann Gudmundsson, Jack Cork, Ashley Westwood, Dwight McNeil, Chris Wood, Ashley Barnes, Angus Gunn","7.3, 7.4, 7.8, 7.5, 8.4, 8.7, 6.9, 6.5, 7.9, 6.4, 9.5, 5.4","Aaron Lennon, Jay Rodriguez, Kevin Long, Jeff Hendrick, Ben Gibson, Joe Hart, Phil Bardsley","6.1, 5.9, 6.0, 6.0, 6.0, 6.0, 6.0","Jannik Vestergaard, Jan Bednarek, Jack Stephens, Yan Valery, Ryan Bertrand, Oriol Romeu, James Ward-Prowse, Danny Ings, Nathan Redmond, Che Adams","6.4, 6.8, 6.1, 5.8, 6.3, 6.0, 6.5, 6.0, 6.0, 5.6","Sofiane Boufal, Michael Obafemi, Pierre-Emile Højbjerg, Maya Yoshida, Moussa Djenepo, Cédric Soares, Alex McCarthy","6.1, 5.8, 5.6, 6.0, 6.0, 6.0, 6.0",10,11,46.5,53.5,55,63,14,6,23,22,21,7,2,7,6,16,"Ashley Barnes, Ashley Barnes, Jóhann Gudmundsson",,"Erik Pieters, Erik Pieters",,0,0,0,0
10-Aug-19,2019/2020,15:00,Crystal Palace,0,0,Everton,Roy Hodgson,Marco Silva,4-4-2,4-2-3-1,6.85,6.58,Selhurst Park,,Jonathan Moss,"Vicente Guaita, Joel Ward, Martin Kelly, Scott Dann, Patrick van Aanholt, Andros Townsend, Luka Milivojevic, James McArthur, Max Meyer, Christian Benteke, Jordan Ayew, Jordan Pickford","7.0, 7.1, 7.0, 7.0, 7.2, 6.8, 6.4, 7.6, 6.7, 7.2, 6.7, 7.1","Wilfried Zaha, Connor Wickham, James McCarthy, Cheikhou Kouyaté, Víctor Camarasa, Gary Cahill, Wayne Hennessey","6.3, 6.1, 6.0, 6.0, 6.0, 6.0, 6.0","Séamus Coleman, Yerry Mina, Michael Keane, Lucas Digne, Morgan Schneiderlin, André Gomes, Richarlison, Gylfi Sigurdsson, Bernard, Dominic Calvert-Lewin","7.0, 7.6, 7.6, 6.2, 5.4, 6.6, 7.0, 6.4, 6.1, 6.4","Jean-Philippe Gbamin, Tom Davies, Moise Kean, Jonas Lössl, Cenk Tosun, Theo Walcott, Mason Holgate","6.2, 6.2, 6.2, 6.0, 6.0, 6.0, 6.0",6,10,35.4,64.6,60,80,8,5,30,18,21,14,6,2,10,12,,,,,2,3,0,1
10-Aug-19,2019/2020,15:00,Watford,0,3,Brighton,Javier Gracia,Graham Potter,4-2-2-2,3-4-3,6.07,7.17,Vicarage Road,Clear,Craig Pawson,"Ben Foster, Kiko Femenía, Craig Dawson, Craig Cathcart, José Holebas, Abdoulaye Doucouré, Etienne Capoue, Gerard Deulofeu, Will Hughes, Andre Gray, Troy Deeney, Mat Ryan","5.5, 6.4, 6.9, 5.9, 6.1, 5.8, 6.2, 5.9, 6.1, 6.0, 6.6, 7.5","Isaac Success, Roberto Pereyra, Christian Kabasele, Heurelho Gomes, Daryl Janmaat, Ken Sema, Tom Cleverley","5.8, 5.9, 6.0, 6.0, 6.0, 6.0, 6.0","Shane Duffy, Dan Burn, Lewis Dunk, Martín Montoya, Solly March, Davy Pröpper, Dale Stephens, Pascal Groß, Glenn Murray, Jürgen Locadia","8.2, 7.4, 8.1, 7.0, 6.9, 7.8, 7.2, 6.8, 6.4, 6.4","Florin Andone, Neal Maupay, Bernardo, Aaron Mooy, Leandro Trossard, Adam Webster, David Button","7.5, 7.2, 6.0, 6.0, 6.0, 6.0, 6.0",11,5,48.2,51.8,79,79,9,6,14,19,12,24,5,2,18,6,,"Abdoulaye Doucouré, Florin Andone, Neal Maupay",,"Davy Pröpper, Lewis Dunk",0,1,0,0
10-Aug-19,2019/2020,17:30,Tottenham,3,1,Aston Villa,Mauricio Pochettino,Dean Smith,4-3-1-2,4-1-4-1,7.01,6.56,Tottenham Hotspur Stadium,Clear,Chris Kavanagh,"Hugo Lloris, Kyle Walker-Peters, Toby Alderweireld, Davinson Sánchez, Danny Rose, Moussa Sissoko, Tanguy Ndombele, Harry Winks, Erik Lamela, Lucas Moura, Harry Kane, Tom Heaton","6.6, 7.4, 7.1, 6.6, 6.3, 6.9, 7.6, 6.8, 7.5, 7.6, 8.7, 6.2","Oliver Skipp, Georges-Kévin Nkoudou, Christian Eriksen, Paulo Gazzaniga, Victor Wanyama, Eric Dier, Serge Aurier","6.0, 6.1, 7.0, 6.0, 6.0, 6.0, 6.0","Ahmed El Mohamady, Björn Engels, Tyrone Mings, Neil Taylor, Conor Hourihane, Trézéguet, Jack Grealish, John McGinn, Anwar El Ghazi, Wesley","6.0, 6.7, 7.9, 6.5, 7.1, 7.3, 6.9, 7.5, 5.8, 6.3","Jonathan Kodjia, Jota, Douglas Luiz, Henri Lansbury, Jed Steer, Ezri Konsa Ngoyo, Matt Targett","5.8, 5.9, 6.0, 6.0, 6.0, 6.0, 6.0",31,7,70.1,29.9,90,78,11,4,10,12,17,29,14,0,15,13,"Tanguy Ndombele, Harry Kane, Harry Kane",John McGinn,"Lucas Moura, Moussa Sissoko",Tyrone Mings,1,0,0,0
11-Aug-19,2019/2020,14:00,Newcastle,0,1,Arsenal,Steve Bruce,Unai Emery,3-5-2,4-2-3-1,6.62,6.83,St. James' Park,Clear,Martin Atkinson,"Martin Dubravka, Fabian Schär, Jamaal Lascelles, Paul Dummett, Javier Manquillo, Matt Ritchie, Jonjo Shelvey, Isaac Hayden, Sean Longstaff, Joelinton, Miguel Almirón, Bernd Leno","6.1, 7.4, 7.1, 7.0, 6.3, 6.4, 6.5, 7.4, 6.3, 7.1, 6.0, 7.5","Jetro Willems, Allan Saint-Maximin, Federico Fernández, Ciaran Clark, Yoshinori Muto, Emil Krafth, Karl Darlow","6.2, 6.3, 6.0, 6.0, 6.0, 6.0, 6.0","Ainsley Maitland-Niles, Sokratis, Calum Chambers, Nacho Monreal, Matteo Guendouzi, Granit Xhaka, Henrikh Mkhitaryan, Joseph Willock, Reiss Nelson, Pierre-Emerick Aubameyang","8.4, 7.0, 6.7, 7.0, 7.2, 7.0, 6.2, 6.6, 6.9, 6.8","Nicolas Pépé, Dani Ceballos, Gabriel Martinelli, Emiliano Martínez, David Luiz, Alexandre Lacazette, Lucas Torreira","6.1, 6.2, 6.0, 6.0, 6.0, 6.0, 6.0",9,8,38.1,61.9,76,85,11,12,21,14,26,11,5,3,4,13,,Pierre-Emerick Aubameyang,,Ainsley Maitland-Niles,1,3,0,0
11-Aug-19,2019/2020,14:00,Leicester,0,0,Wolves,Brendan Rodgers,Nuno Espírito Santo,4-1-4-1,3-5-2,6.93,6.77,King Power Stadium,Clear,Andre Marriner,"Kasper Schmeichel, Ricardo Pereira, Çaglar Söyüncü, Jonny Evans, Ben Chilwell, Wilfred Ndidi, Ayoze Pérez, Youri Tielemans, Hamza Choudhury, James Maddison, Jamie Vardy, Rui Patrício","7.0, 7.7, 7.4, 7.5, 6.7, 7.6, 6.4, 7.2, 6.6, 7.3, 6.3, 6.7","Harvey Barnes, Marc Albrighton, Dennis Praet, Wes Morgan, Kelechi Iheanacho, James Justin, Danny Ward","6.3, 6.1, 6.0, 6.0, 6.0, 6.0, 6.0","Willy Boly, Conor Coady, Ryan Bennett, Matt Doherty, Jonny, Leander Dendoncker, João Moutinho, Rúben Neves, Raúl Jiménez, Diogo Jota","7.8, 6.8, 7.0, 6.3, 6.5, 7.1, 7.2, 6.7, 7.2, 6.5","Romain Saïss, Patrick Cutrone, Pedro Neto, Rúben Vinagre, Adama Traoré, John Ruddy, Morgan Gibbs-White","6.3, 6.1, 6.0, 6.0, 6.0, 6.0, 6.0",16,8,70,30,85,69,16,12,24,22,20,19,12,3,7,12,,,,,0,2,0,0
11-Aug-19,2019/2020,16:30,Man Utd,4,0,Chelsea,Ole Gunnar Solskjær,Frank Lampard,4-2-3-1,4-2-3-1,7.49,6.19,Old Trafford,Clear,Anthony Taylor,"David de Gea, Aaron Wan-Bissaka, Victor Lindelöf, Harry Maguire, Luke Shaw, Paul Pogba, Scott McTominay, Jesse Lingard, Andreas Pereira, Marcus Rashford, Anthony Martial, Kepa Arrizabalaga","8.1, 8.3, 7.1, 8.0, 7.6, 8.3, 7.2, 7.1, 7.4, 8.3, 8.3, 5.2","Daniel James, Mason Greenwood, Juan Mata, Sergio Romero, Nemanja Matic, Ashley Young, Axel Tuanzebe","7.1, 6.0, 6.1, 6.0, 6.0, 6.0, 6.0","César Azpilicueta, Andreas Christensen, Kurt Zouma, Emerson, Mateo Kovacic, Jorginho, Pedro, Mason Mount, Ross Barkley, Tammy Abraham","6.3, 6.2, 4.9, 7.1, 6.7, 5.8, 7.1, 6.8, 6.3, 6.3","Christian Pulisic, Olivier Giroud, N'Golo Kanté, Willy Caballero, Kenedy, Marcos Alonso, Fikayo Tomori","6.1, 5.8, 6.1, 6.0, 6.0, 6.0, 6.0",11,18,46.2,53.8,81,85,14,13,13,9,16,21,3,5,15,5,"Marcus Rashford, Anthony Martial, Marcus Rashford, Daniel James",,"Andreas Pereira, Paul Pogba, Paul Pogba",,3,4,0,0
17-Aug-19,2019/2020,12:30,Arsenal,2,1,Burnley,Unai Emery,Sean Dyche,4-2-3-1,4-4-2,7.03,6.62,Emirates Stadium,Clear,Mike Dean,"Bernd Leno, Ainsley Maitland-Niles, David Luiz, Sokratis, Nacho Monreal, Matteo Guendouzi, Joseph Willock, Pierre-Emerick Aubameyang, Dani Ceballos, Reiss Nelson, Alexandre Lacazette, Nick Pope","6.6, 7.1, 6.7, 7.3, 7.1, 7.7, 7.1, 7.2, 8.2, 6.2, 7.4, 7.4","Nicolas Pépé, Lucas Torreira, Sead Kolasinac, Emiliano Martínez, Henrikh Mkhitaryan, Gabriel Martinelli, Calum Chambers","7.5, 6.2, 6.0, 6.0, 6.0, 6.0, 6.0","Matthew Lowton, Ben Mee, James Tarkowski, Erik Pieters, Jóhann Gudmundsson, Ashley Westwood, Jack Cork, Dwight McNeil, Chris Wood, Ashley Barnes","6.2, 6.9, 6.4, 6.8, 6.8, 6.4, 6.9, 6.8, 6.1, 7.4","Jay Rodriguez, Aaron Lennon, Jeff Hendrick, Joe Hart, Ben Gibson, Charlie Taylor, Phil Bardsley","6.0, 6.2, 6.0, 6.0, 6.0, 6.0, 6.0",15,18,67.5,32.5,84,65,14,4,21,20,12,16,10,7,10,6,"Alexandre Lacazette, Pierre-Emerick Aubameyang",Ashley Barnes,Dani Ceballos,,2,1,0,0
17-Aug-19,2019/2020,15:00,Aston Villa,1,2,Bournemouth,Dean Smith,Eddie Howe,4-3-3,4-4-1-1,6.61,6.81,Villa Park,Clear,Martin Atkinson,"Tom Heaton, Ahmed El Mohamady, Björn Engels, Tyrone Mings, Neil Taylor, Douglas Luiz, Jack Grealish, John McGinn, Trézéguet, Wesley, Anwar El Ghazi, Aaron Ramsdale","5.6, 7.7, 6.8, 7.1, 6.3, 6.8, 7.0, 7.0, 6.4, 6.7, 6.3, 7.5","Keinan Davis, Jota, Conor Hourihane, Jed Steer, Matt Targett, Ezri Konsa Ngoyo, Henri Lansbury","6.1, 6.2, 6.0, 6.0, 6.0, 6.0, 6.0","Adam Smith, Nathan Aké, Steve Cook, Charlie Daniels, Harry Wilson, Jefferson Lerma, Philip Billing, Ryan Fraser, Joshua King, Callum Wilson","6.7, 6.8, 7.4, 6.7, 7.2, 6.7, 6.7, 6.3, 7.1, 7.0","Dominic Solanke, Andrew Surman, Artur Boruc, Diego Rico, Jack Stacey, Jordon Ibe, Chris Mepham","6.3, 6.1, 6.0, 6.0, 6.0, 6.0, 6.0",21,12,62.6,37.4,82,71,9,3,28,22,7,15,10,5,14,5,Douglas Luiz,"Joshua King, Harry Wilson",Jack Grealish,,0,2,0,0
17-Aug-19,2019/2020,15:00,Brighton,1,1,West Ham,Graham Potter,Manuel Pellegrini,3-4-3,4-1-4-1,6.73,6.72,Amex Stadium,Clear,Anthony Taylor,"Mat Ryan, Shane Duffy, Dan Burn, Lewis Dunk, Martín Montoya, Solly March, Davy Pröpper, Dale Stephens, Pascal Groß, Glenn Murray, Leandro Trossard, Lukasz Fabianski","6.4, 6.5, 7.2, 7.1, 6.8, 7.3, 7.0, 6.9, 7.4, 6.4, 7.0, 6.5","Florin Andone, Neal Maupay, Aaron Mooy, Bernardo, Jürgen Locadia, Adam Webster, David Button","6.2, 6.1, 5.9, 6.0, 6.0, 6.0, 6.0","Ryan Fredericks, Issa Diop, Angelo Ogbonna, Arthur Masuaku, Declan Rice, Robert Snodgrass, Manuel Lanzini, Jack Wilshere, Pablo Fornals, Chicharito","6.9, 7.1, 7.0, 7.2, 6.6, 7.4, 8.1, 6.2, 6.3, 6.9","Michail Antonio, Andriy Yarmolenko, Carlos Sánchez, Pablo Zabaleta, Fabián Balbuena, Roberto Jiménez, Albian Ajeti","6.1, 5.9, 6.0, 6.0, 6.0, 6.0, 6.0",16,8,57.3,42.7,79,73,6,19,31,14,20,22,8,6,12,16,Leandro Trossard,Chicharito,,Manuel Lanzini,0,2,0,0
17-Aug-19,2019/2020,15:00,Everton,1,0,Watford,Marco Silva,Javier Gracia,4-2-3-1,4-2-2-2,7.02,6.51,Goodison Park,Clear,Lee Mason,"Jordan Pickford, Séamus Coleman, Yerry Mina, Michael Keane, Lucas Digne, André Gomes, Jean-Philippe Gbamin, Richarlison, Gylfi Sigurdsson, Bernard, Dominic Calvert-Lewin, Ben Foster","7.1, 7.0, 7.5, 7.4, 7.8, 6.8, 7.3, 6.5, 6.7, 8.6, 6.9, 6.1","Mason Holgate, Theo Walcott, Moise Kean, Jonas Lössl, Alex Iwobi, Cenk Tosun, Tom Davies","6.4, 6.0, 6.4, 6.0, 6.0, 6.0, 6.0","Kiko Femenía, Craig Dawson, Craig Cathcart, José Holebas, Etienne Capoue, Abdoulaye Doucouré, Roberto Pereyra, Will Hughes, Gerard Deulofeu, Troy Deeney","6.8, 7.2, 7.0, 7.2, 6.5, 6.6, 5.7, 6.5, 6.6, 6.6","Tom Cleverley, Danny Welbeck, Andre Gray, Christian Kabasele, Heurelho Gomes, Daryl Janmaat, Domingos Quina","6.1, 6.3, 6.1, 6.0, 6.0, 6.0, 6.0",12,8,44.1,55.9,67,72,19,8,28,27,20,34,4,7,24,11,Bernard,,Lucas Digne,,2,3,0,0
17-Aug-19,2019/2020,15:00,Norwich,3,1,Newcastle,Daniel Farke,Steve Bruce,4-2-3-1,3-5-2,7.08,6.35,Carrow Road,Clear,Stuart Attwell,"Tim Krul, Max Aarons, Ben Godfrey, Grant Hanley, Jamal Lewis, Moritz Leitner, Tom Trybull, Todd Cantwell, Marco Stiepermann, Emiliano Buendía, Teemu Pukki, Martin Dubravka","6.9, 6.2, 6.6, 7.1, 7.4, 7.2, 7.8, 7.5, 7.3, 7.1, 10, 6.5","Sam Byram, Alexander Tettey, Mario Vrancic, Ralf Fährmann, Dennis Srbeny, Patrick Roberts, Kenny McLean","6.0, 5.9, 6.0, 6.0, 6.0, 6.0, 6.0","Fabian Schär, Jamaal Lascelles, Paul Dummett, Emil Krafth, Matt Ritchie, Jonjo Shelvey, Isaac Hayden, Ki Sung-Yueng, Joelinton, Miguel Almirón","6.7, 6.4, 5.9, 5.8, 6.9, 7.4, 6.2, 6.3, 5.9, 6.1","Sean Longstaff, Yoshinori Muto, Federico Fernández, Ciaran Clark, Jetro Willems, Javier Manquillo, Karl Darlow","6.5, 5.9, 6.0, 6.0, 6.0, 6.0, 6.0",15,12,63.3,36.7,88,81,11,7,14,9,14,14,7,5,10,8,"Teemu Pukki, Teemu Pukki, Teemu Pukki",Jonjo Shelvey,Todd Cantwell,Sean Longstaff,1,3,0,0
17-Aug-19,2019/2020,15:00,Southampton,1,2,Liverpool,Ralph Hasenhüttl,Jürgen Klopp,3-5-2,4-3-3,6.44,6.75,St. Mary's Stadium,Clear,Andre Marriner,"Angus Gunn, Jannik Vestergaard, Maya Yoshida, Jan Bednarek, Yan Valery, Ryan Bertrand, Pierre-Emile Højbjerg, Oriol Romeu, James Ward-Prowse, Nathan Redmond, Che Adams, Adrián","6.9, 6.7, 6.1, 5.7, 6.9, 5.6, 6.5, 6.7, 6.9, 6.7, 6.3, 5.7","Stuart Armstrong, Danny Ings, Moussa Djenepo, Kevin Danso, Michael Obafemi, Cédric Soares, Fraser Forster","6.0, 7.2, 6.2, 6.0, 6.0, 6.0, 6.0","Trent Alexander-Arnold, Joel Matip, Virgil van Dijk, Andrew Robertson, Georginio Wijnaldum, Alex Oxlade-Chamberlain, James Milner, Mohamed Salah, Roberto Firmino, Sadio Mané","6.1, 7.3, 6.8, 7.4, 6.6, 7.2, 6.7, 6.3, 7.7, 8.6","Jordan Henderson, Fabinho, Divock Origi, Xherdan Shaqiri, Joseph Gomez, Andy Lonergan, Adam Lallana","6.0, 6.0, 6.0, 6.0, 6.0, 6.0, 6.0",14,15,36.2,63.8,65,78,10,10,15,19,15,7,5,9,6,7,Danny Ings,"Sadio Mané, Roberto Firmino",,"James Milner, Sadio Mané",2,1,0,0
17-Aug-19,2019/2020,17:30,Man City,2,2,Tottenham,Josep Guardiola,Mauricio Pochettino,4-2-3-1,4-2-3-1,6.84,6.82,Etihad Stadium,Clear,Michael Oliver,"Ederson, Kyle Walker, Nicolás Otamendi, Aymeric Laporte, Oleksandr Zinchenko, Ilkay Gündogan, Rodrigo, Bernardo Silva, Kevin De Bruyne, Raheem Sterling, Sergio Agüero, Hugo Lloris","5.6, 6.8, 7.0, 6.8, 6.5, 6.4, 7.3, 7.5, 8.7, 7.4, 7.0, 8.2","David Silva, Gabriel Jesus, Riyad Mahrez, Fernandinho, Claudio Bravo, João Cancelo, Phil Foden","6.0, 6.7, 5.9, 6.0, 6.0, 6.0, 6.0","Kyle Walker-Peters, Toby Alderweireld, Davinson Sánchez, Danny Rose, Tanguy Ndombele, Harry Winks, Moussa Sissoko, Erik Lamela, Christian Eriksen, Harry Kane","6.5, 6.6, 7.0, 6.3, 7.8, 6.1, 6.6, 8.1, 6.3, 6.2","Oliver Skipp, Lucas Moura, Giovani Lo Celso, Paulo Gazzaniga, Jan Vertonghen, Eric Dier, Ben Davies","6.1, 7.7, 6.0, 6.0, 6.0, 6.0, 6.0",30,3,55.4,44.6,90,84,9,15,15,10,15,17,13,2,9,10,"Raheem Sterling, Sergio Agüero","Erik Lamela, Lucas Moura","Kevin De Bruyne, Kevin De Bruyne","Tanguy Ndombele, Erik Lamela",1,0,0,0
18-Aug-19,2019/2020,14:00,Sheff Utd,1,0,Crystal Palace,Chris Wilder,Roy Hodgson,3-5-2,4-4-2,7.02,6.60,Bramall Lane,Clear,David Coote,"Dean Henderson, John Egan, Chris Basham, Jack O'Connell, George Baldock, Enda Stevens, John Lundstram, John Fleck, Oliver Norwood, Callum Robinson, David McGoldrick, Vicente Guaita","7.4, 6.9, 7.5, 7.6, 7.4, 7.5, 8.1, 6.4, 7.4, 6.1, 6.8, 6.9","Oliver McBurnie, Phil Jagielka, Luke Freeman, Muhamed Besic, Billy Sharp, Ben Osborn, Simon Moore","6.3, 6.3, 6.5, 6.0, 6.0, 6.0, 6.0","Joel Ward, Martin Kelly, Scott Dann, Patrick van Aanholt, Andros Townsend, Luka Milivojevic, James McArthur, Max Meyer, Christian Benteke, Wilfried Zaha","7.6, 6.4, 7.2, 6.1, 7.2, 6.4, 6.2, 6.2, 7.1, 6.3","Connor Wickham, James McCarthy, Jeffrey Schlupp, Jordan Ayew, Cheikhou Kouyaté, Gary Cahill, Wayne Hennessey","5.9, 6.5, 6.3, 6.0, 6.0, 6.0, 6.0",15,6,42.5,57.5,77,79,9,10,23,27,20,21,8,4,10,10,John Lundstram,,,,3,1,0,0
18-Aug-19,2019/2020,16:30,Chelsea,1,1,Leicester,Frank Lampard,Brendan Rodgers,4-3-3,4-1-4-1,6.79,6.72,Stamford Bridge,Clear,Oliver Langford,"Kepa Arrizabalaga, César Azpilicueta, Andreas Christensen, Kurt Zouma, Emerson, N'Golo Kanté, Jorginho, Mason Mount, Pedro, Olivier Giroud, Christian Pulisic, Kasper Schmeichel","7.0, 7.1, 6.7, 6.8, 7.5, 6.5, 6.4, 8.2, 6.6, 7.2, 6.6, 7.0","Tammy Abraham, Mateo Kovacic, Willian, Willy Caballero, Marcos Alonso, Fikayo Tomori, Ross Barkley","6.1, 6.2, 6.2, 6.0, 6.0, 6.0, 6.0","Ricardo Pereira, Çaglar Söyüncü, Jonny Evans, Christian Fuchs, Wilfred Ndidi, Ayoze Pérez, Youri Tielemans, Hamza Choudhury, James Maddison, Jamie Vardy","8.0, 7.0, 6.8, 6.7, 7.3, 6.6, 6.6, 6.4, 6.9, 5.8","Marc Albrighton, Dennis Praet, Wes Morgan, Kelechi Iheanacho, Harvey Barnes, James Justin, Danny Ward","6.1, 6.3, 6.0, 6.0, 6.0, 6.0, 6.0",14,12,50.2,49.8,79,77,10,13,23,13,25,29,4,5,20,15,Mason Mount,Wilfred Ndidi,,James Maddison,1,0,0,0
19-Aug-19,2019/2020,20:00,Wolves,1,1,Man Utd,Nuno Espírito Santo,Ole Gunnar Solskjær,3-5-2,4-2-3-1,6.57,6.59,Molineux Stadium,Clear,Jonathan Moss,"Rui Patrício, Willy Boly, Conor Coady, Ryan Bennett, Matt Doherty, Jonny, Leander Dendoncker, Rúben Neves, João Moutinho, Raúl Jiménez, Diogo Jota, David de Gea","6.8, 6.8, 6.5, 6.2, 5.8, 7.0, 6.2, 7.5, 7.5, 7.0, 6.1, 6.1","Adama Traoré, Pedro Neto, Patrick Cutrone, Romain Saïss, Rúben Vinagre, Morgan Gibbs-White, John Ruddy","6.7, 5.9, 6.0, 6.0, 6.0, 6.0, 6.0","Aaron Wan-Bissaka, Victor Lindelöf, Harry Maguire, Luke Shaw, Paul Pogba, Scott McTominay, Daniel James, Jesse Lingard, Marcus Rashford, Anthony Martial","7.4, 6.6, 7.2, 6.9, 6.6, 6.5, 6.2, 6.3, 6.9, 7.5","Mason Greenwood, Juan Mata, Andreas Pereira, Sergio Romero, Nemanja Matic, Axel Tuanzebe, Ashley Young","6.1, 6.0, 6.0, 6.0, 6.0, 6.0, 6.0",6,9,34.4,65.6,75,87,9,7,10,20,17,23,4,6,11,9,Rúben Neves,Anthony Martial,João Moutinho,Marcus Rashford,2,2,0,0
23-Aug-19,2019/2020,20:00,Aston Villa,2,0,Everton,Dean Smith,Marco Silva,4-1-4-1,4-2-3-1,7.10,6.32,Villa Park,Clear,Michael Oliver,"Tom Heaton, Frederic Guilbert, Björn Engels, Tyrone Mings, Neil Taylor, Douglas Luiz, Jota, Jack Grealish, John McGinn, Trézéguet, Wesley, Jordan Pickford","6.8, 7.2, 7.3, 7.3, 6.8, 6.9, 7.9, 7.0, 7.9, 6.3, 7.4, 5.8","Anwar El Ghazi, Ahmed El Mohamady, Conor Hourihane, Jed Steer, Ezri Konsa Ngoyo, Keinan Davis, Henri Lansbury","7.4, 6.1, 6.0, 6.0, 6.0, 6.0, 6.0","Séamus Coleman, Yerry Mina, Michael Keane, Lucas Digne, Morgan Schneiderlin, André Gomes, Richarlison, Gylfi Sigurdsson, Bernard, Dominic Calvert-Lewin","6.6, 5.9, 6.3, 6.7, 6.9, 5.8, 6.9, 6.3, 6.0, 6.3","Theo Walcott, Alex Iwobi, Moise Kean, Djibril Sidibé, Maarten Stekelenburg, Mason Holgate, Tom Davies","5.7, 7.0, 6.3, 6.0, 6.0, 6.0, 6.0",7,12,35.2,64.8,73,81,11,13,16,28,12,16,0,6,10,10,"Wesley, Anwar El Ghazi",,"Jota, John McGinn",,2,3,0,0
24-Aug-19,2019/2020,12:30,Norwich,2,3,Chelsea,Daniel Farke,Frank Lampard,4-2-3-1,4-3-3,6.56,7.21,Carrow Road,Clear,Martin Atkinson,"Tim Krul, Max Aarons, Ben Godfrey, Grant Hanley, Jamal Lewis, Moritz Leitner, Tom Trybull, Emiliano Buendía, Marco Stiepermann, Todd Cantwell, Teemu Pukki, Kepa Arrizabalaga","6.5, 6.2, 7.0, 7.2, 6.2, 6.3, 6.0, 7.5, 6.1, 6.8, 7.8, 6.5","Kenny McLean, Dennis Srbeny, Mario Vrancic, Ralf Fährmann, Alexander Tettey, Timm Klose, Sam Byram","6.3, 6.1, 6.0, 6.0, 6.0, 6.0, 6.0","César Azpilicueta, Andreas Christensen, Kurt Zouma, Emerson, Mateo Kovacic, Jorginho, Ross Barkley, Christian Pulisic, Tammy Abraham, Mason Mount","7.5, 6.8, 6.8, 8.7, 7.8, 7.2, 7.9, 7.1, 8.3, 8.2","Marcos Alonso, Olivier Giroud, Willian, Willy Caballero, Michy Batshuayi, Fikayo Tomori","6.1, 5.9, 6.1, 6.0, 6.0, 6.0",6,23,46.6,53.4,81,84,5,21,12,17,16,26,1,8,11,13,"Todd Cantwell, Teemu Pukki","Tammy Abraham, Mason Mount, Tammy Abraham","Teemu Pukki, Emiliano Buendía","César Azpilicueta, Christian Pulisic, Mateo Kovacic",1,1,0,0
24-Aug-19,2019/2020,15:00,Sheff Utd,1,2,Leicester,Chris Wilder,Brendan Rodgers,3-5-2,4-3-3,6.47,6.83,Bramall Lane,Clear,Andy Madley,"Dean Henderson, John Egan, Chris Basham, Jack O'Connell, George Baldock, Enda Stevens, Luke Freeman, John Lundstram, Oliver Norwood, Callum Robinson, David McGoldrick, Kasper Schmeichel","5.4, 6.6, 5.4, 6.9, 7.0, 7.1, 7.0, 5.9, 6.7, 6.3, 6.6, 6.2","Oliver McBurnie, Billy Sharp, Ravel Morrison, Muhamed Besic, Phil Jagielka, Simon Moore, Ben Osborn","7.3, 6.3, 5.9, 6.0, 6.0, 6.0, 6.0","Ricardo Pereira, Çaglar Söyüncü, Jonny Evans, Christian Fuchs, Dennis Praet, Youri Tielemans, Hamza Choudhury, Ayoze Pérez, Jamie Vardy, James Maddison","6.5, 7.9, 6.6, 6.3, 6.4, 6.6, 7.1, 6.9, 7.1, 8.3","Harvey Barnes, Wes Morgan, Nampalys Mendy, Demarai Gray, James Justin, Marc Albrighton, Danny Ward","7.1, 6.4, 6.2, 6.0, 6.0, 6.0, 6.0",7,10,49.1,50.9,75,79,11,9,25,21,16,13,7,4,10,10,Oliver McBurnie,"Jamie Vardy, Harvey Barnes",George Baldock,"James Maddison, Çaglar Söyüncü",1,0,0,0
24-Aug-19,2019/2020,15:00,Brighton,0,2,Southampton,Graham Potter,Ralph Hasenhüttl,3-4-3,4-2-2-2,6.42,7.05,Amex Stadium,Clear,Kevin Friend,"Mat Ryan, Shane Duffy, Dan Burn, Lewis Dunk, Martín Montoya, Solly March, Davy Pröpper, Dale Stephens, Neal Maupay, Florin Andone, Leandro Trossard, Angus Gunn","5.8, 6.6, 6.5, 6.8, 6.7, 7.2, 6.6, 6.2, 6.9, 5.2, 7.0, 7.3","Glenn Murray, Jürgen Locadia, Pascal Groß, Aaron Mooy, Bernardo, Adam Webster, David Button","6.1, 6.1, 6.2, 6.0, 6.0, 6.0, 6.0","Yan Valery, Jannik Vestergaard, Jan Bednarek, Kevin Danso, Pierre-Emile Højbjerg, Oriol Romeu, James Ward-Prowse, Nathan Redmond, Danny Ings, Che Adams","6.6, 7.8, 7.2, 6.8, 6.5, 6.6, 7.2, 8.3, 6.8, 6.5","Stuart Armstrong, Sofiane Boufal, Moussa Djenepo, Michael Obafemi, Maya Yoshida, Cédric Soares, Alex McCarthy","6.2, 7.1, 7.8, 6.0, 6.0, 6.0, 6.0",12,12,50.7,49.3,75,75,11,11,24,15,16,19,8,5,10,11,,"Moussa Djenepo, Nathan Redmond",,"Danny Ings, Sofiane Boufal",1,3,1,0
24-Aug-19,2019/2020,15:00,Watford,1,3,West Ham,Javier Gracia,Manuel Pellegrini,4-1-2-1-2,4-2-3-1,6.59,7.15,Vicarage Road,Clear,Chris Kavanagh,"Ben Foster, Kiko Femenía, Craig Dawson, Craig Cathcart, José Holebas, Etienne Capoue, Abdoulaye Doucouré, Will Hughes, Tom Cleverley, Gerard Deulofeu, Andre Gray, Lukasz Fabianski","7.1, 6.2, 6.0, 6.2, 6.5, 6.8, 7.1, 7.0, 6.5, 7.1, 7.5, 6.7","Danny Welbeck, Ismaila Sarr, Domingos Quina, Christian Kabasele, Heurelho Gomes, Daryl Janmaat, Nathaniel Chalobah","6.2, 6.1, 6.0, 6.0, 6.0, 6.0, 6.0","Ryan Fredericks, Issa Diop, Angelo Ogbonna, Arthur Masuaku, Mark Noble, Declan Rice, Andriy Yarmolenko, Manuel Lanzini, Felipe Anderson, Sébastien Haller","6.5, 6.7, 7.0, 7.7, 7.1, 7.4, 7.1, 7.5, 8.4, 9.0","Michail Antonio, Pablo Fornals, Carlos Sánchez, Pablo Zabaleta, Fabián Balbuena, Roberto Jiménez, Albian Ajeti","6.6, 6.4, 6.0, 6.0, 6.0, 6.0, 6.0",23,16,54.9,45.1,84,79,8,10,16,17,17,17,8,7,12,13,Andre Gray,"Mark Noble, Sébastien Haller, Sébastien Haller",Will Hughes,Felipe Anderson,1,1,0,0
